BibliographyType,ISBN,Identifier,Author,Title,Journal,Volume,Number,Month,Pages,Year,Address,Note,URL,Booktitle,Chapter,Edition,Series,Editor,Publisher,ReportType,Howpublished,Institution,Organizations,School,Annote,Abstract,Custom2,Custom3,Custom4,Custom5
7,,,"O'Donnell, Penny; Lloyd, Justine & Dreher, Tanja","Listening, pathbuilding and continuations: A research agenda for the analysis of listening",Continuum,23,4,August,423--439,2009,,,http://www.tandfonline.com/doi/abs/10.1080/10304310903056252,Continuum,,,,,Routledge,,,,,,,"This introductory paper posits ?listening? as a rubric for reframing contemporary media theory and practice. We propose moving beyond questions of voice, speaking and representation to focus on often-ignored questions of listening as the ?other side? of communication. This article sets out the ways in which it may be possible to address the neglected question of listening, not in isolation but rather, following Susan Bickford's notion of ?pathbuilding?, through explorations of speaking and listening, voice and hearing, logos and interpretation/deconstruction. The article argues for more receptive forms of public discourse and media practice, while seeking to place the recent problematization of listening in a critical framework. Through a survey of theorizations of listening and explication of their research agenda, the authors consider listening in relation to conflict and inequality in diverse practices of citizenship. A central aim is to push discussion of listening practices beyond individual, personal, and private forms of discourse and to identify a spectrum of listening practices that complicate the speaking/listening binary. This introductory paper posits ?listening? as a rubric for reframing contemporary media theory and practice. We propose moving beyond questions of voice, speaking and representation to focus on often-ignored questions of listening as the ?other side? of communication. This article sets out the ways in which it may be possible to address the neglected question of listening, not in isolation but rather, following Susan Bickford's notion of ?pathbuilding?, through explorations of speaking and listening, voice and hearing, logos and interpretation/deconstruction. The article argues for more receptive forms of public discourse and media practice, while seeking to place the recent problematization of listening in a critical framework. Through a survey of theorizations of listening and explication of their research agenda, the authors consider listening in relation to conflict and inequality in diverse practices of citizenship. A central aim is to push discussion of listening practices beyond individual, personal, and private forms of discourse and to identify a spectrum of listening practices that complicate the speaking/listening binary.",doi: 10.1080/10304310903056252,,,
7,,,"Ojha, Hemant R.; Khatri, Dil B.; Shrestha, Krishna K.; Bhattarai, Basundhara; Baral, Jagadish C.; Basnett, Bimbika Sijapati; Goutam, Keshab; Sunam, Ramesh; Banjade, Mani R.; Jana, Sudeep; Bushley, Bryan; Dhungana, Sindhu Prasad & Paudel, Dinesh","Can Evidence and Voice Influence Policy? A Critical Assessment of Nepal's Forestry Sector Strategy, 2014",Society & Natural Resources,29,3,March,357--373,2016,,,http://dx.doi.org/10.1080/08941920.2015.1122851,Society & Natural Resources,,,,,Routledge,,,,,,,"This article examines Nepal's recently prepared Forestry Sector Strategy (FSS) (as of 2014) in terms of the use of scientific evidence and the quality of stakeholder participation. By reviewing the content and analyzing the context of its development during 2012?2014, we found that the transitional politics and overt influence of international development agencies dominated the process and content of the FSS. Although the FSS was developed through a significant stakeholder engagement, there was limited use of the available scientific evidence. The FSS was narrowly conceived as a deliverable of supporting aid programs, with limited demand for a politically meaningful policy processes. While civil society groups were consulted, they largely failed to present an independent voice due to their dependence on funding agencies. Our assessment calls for rethinking policy development in a way that facilitates assertive and independent participation by a range of actors and make better use of the available research. This article examines Nepal's recently prepared Forestry Sector Strategy (FSS) (as of 2014) in terms of the use of scientific evidence and the quality of stakeholder participation. By reviewing the content and analyzing the context of its development during 2012?2014, we found that the transitional politics and overt influence of international development agencies dominated the process and content of the FSS. Although the FSS was developed through a significant stakeholder engagement, there was limited use of the available scientific evidence. The FSS was narrowly conceived as a deliverable of supporting aid programs, with limited demand for a politically meaningful policy processes. While civil society groups were consulted, they largely failed to present an independent voice due to their dependence on funding agencies. Our assessment calls for rethinking policy development in a way that facilitates assertive and independent participation by a range of actors and make better use of the available research.",doi: 10.1080/08941920.2015.1122851,,,
7,,,"Reed, Pam & Butler, Tamara",Flipping the Script: When Service-Learning Recipients Become Service-Learning Givers,Theory Into Practice,54,1,January,55--62,2015,,,http://dx.doi.org/10.1080/00405841.2015.977663,Theory Into Practice,,,,,Routledge,,,,,,,"Urban education is a complex system that is often shrouded in stereotypes, labels, and barriers. Service-learning is well-entrenched in suburban institutions, but is a fledgling or grassroots organization in the urban education community. Often, suburban service-learning initiatives have taken the tone of community service in that it is often directed (albeit often inadvertently) at lower socio-economic families (e.g., to help the homeless, fill the food banks for the hungry, participate in clothing drives). Such initiatives leave some urban students feeling disenfranchised, powerless, and dependent. However, critical service-learning in urban schools can provide a connection to the community, as well as a sense of empowerment, confidence, and intrinsic motivation (Mitchell, 2007). When urban students see themselves as vital, powerful participants in giving back instead of being given to, they become critical partners, young leaders, and civically engaged citizens. Therefore, in this article, Pam, a middle school educator, and Tamara, a service-learning partner, examine how a teacher can institute critical service-learning programs in an urban classroom. By highlighting a teacher's intrinsic and extrinsic shifts, practical applications, and students' collaborations and reflections, this article illustrates how to move to critical service-learning in urban contexts. This examination has implications for how specific critical service-learning components can help teachers work with students to move toward socio-emotional growth. Urban education is a complex system that is often shrouded in stereotypes, labels, and barriers. Service-learning is well-entrenched in suburban institutions, but is a fledgling or grassroots organization in the urban education community. Often, suburban service-learning initiatives have taken the tone of community service in that it is often directed (albeit often inadvertently) at lower socio-economic families (e.g., to help the homeless, fill the food banks for the hungry, participate in clothing drives). Such initiatives leave some urban students feeling disenfranchised, powerless, and dependent. However, critical service-learning in urban schools can provide a connection to the community, as well as a sense of empowerment, confidence, and intrinsic motivation (Mitchell, 2007). When urban students see themselves as vital, powerful participants in giving back instead of being given to, they become critical partners, young leaders, and civically engaged citizens. Therefore, in this article, Pam, a middle school educator, and Tamara, a service-learning partner, examine how a teacher can institute critical service-learning programs in an urban classroom. By highlighting a teacher's intrinsic and extrinsic shifts, practical applications, and students' collaborations and reflections, this article illustrates how to move to critical service-learning in urban contexts. This examination has implications for how specific critical service-learning components can help teachers work with students to move toward socio-emotional growth.",doi: 10.1080/00405841.2015.977663,,,
7,,,"Schaller, David T.",The Meaning Makes It Fun,Journal of Museum Education,36,3,September,261--268,2011,,,http://dx.doi.org/10.1080/10598650.2011.11510707,Journal of Museum Education,,,,,Routledge,,,,,,,"AbstractMuseum games can be a powerful meaning-making experience for players, but only if we understand that what makes games fun is also what makes them meaningful. Renowned game designer Sid Meier (Civilization, Railroad Tycoon, Pirates) famously defined a good game as ?a series of interesting choices.? What makes choices interesting? The same things that make them meaningful: consequences, context, and a sawy appeal to human psychology. When designed well, these choices can make even mundane content meaningful. So imagine the possibilities when we use the stuff of museums?art, science, history, and technology?as our content and context. Whether creating a game or a simpler activity, we can draw on principles of game design to weave a series of interesting choices that honors our real-world content while engaging visitors in thoughtful ways. This article considers that most common type of ?game??the quiz?before analyzing the board game Monopoly for attributes of interesting choices, and finally discusses how those attributes are built into several games for cultural institutions. AbstractMuseum games can be a powerful meaning-making experience for players, but only if we understand that what makes games fun is also what makes them meaningful. Renowned game designer Sid Meier (Civilization, Railroad Tycoon, Pirates) famously defined a good game as ?a series of interesting choices.? What makes choices interesting? The same things that make them meaningful: consequences, context, and a sawy appeal to human psychology. When designed well, these choices can make even mundane content meaningful. So imagine the possibilities when we use the stuff of museums?art, science, history, and technology?as our content and context. Whether creating a game or a simpler activity, we can draw on principles of game design to weave a series of interesting choices that honors our real-world content while engaging visitors in thoughtful ways. This article considers that most common type of ?game??the quiz?before analyzing the board game Monopoly for attributes of interesting choices, and finally discusses how those attributes are built into several games for cultural institutions.",doi: 10.1080/10598650.2011.11510707,,,
7,,,"Schulz, Tobias & Baumgartner, Daniel",Volunteer Organizations: Odds or Obstacle for Small Business Formation in Rural Areas? Evidence from Swiss Municipalities,Regional Studies,47,4,April,597--612,2013,,,http://dx.doi.org/10.1080/00343404.2011.587799,Regional Studies,,,,,Routledge,,,,,,,"Schulz T. and Baumgartner D. Volunteer organizations: odds or obstacle for small business formation in rural areas? Evidence from Swiss municipalities, Regional Studies. Rural development strategies often claim to stimulate new firm foundations, for example, by supporting locally active volunteer organizations for economic development. Based on survey data from 254 rural Swiss municipalities, this paper analyses the influence of different types of volunteer organizations on new firm foundations by applying a zero-inflated Poisson regression approach. The results suggest that, generally, a higher number of volunteer organizations positively influence the foundation of local firms. Too many ?bonding? associations for economic development, however, lead to decreasing foundations. Exclusive support of organizations for economic development is thus not effective for stimulating new firm foundations in rural areas. Schulz T. and Baumgartner D. ??????????????????????????????????????????????????????????????????????????????????? 254 ????????????????????????????????????????????????????????????????????????????????????????????????????????????????????????????????????????????? ???????????????????????????????? Schulz T. et Baumgartner D. Les organisations bénévoles: des atouts ou des inconvénients pour la création des petites entreprises en zone rurale? Des preuves provenant des municipalités suisses, Regional Studies. La politique d'aménagement du territoire en faveur des zones rurales prétend souvent encourager la création d'entreprise, par exemple, en soutenant des organisations bénévoles pour le développement économique qui jouent un rôle actif sur le plan local. Puisant dans des enquêtes auprès de 254 municipalités rurales suisses, cet article cherche à analyser l'influence de divers genres d'organisations bénévoles sur la création de nouvelles entreprises en appliquant une régression du type Poisson d'ordre zéro. En règle générale, les résultats laissent supposer qu'un nombre non-négligeable d'organisations bénévoles influent de façon positive sur la création d'entreprises locales. Cependant, trop d'organisations ?affectives? pour le développement économique entraînent une baisse du nombre d?établissements. Il s'avère, donc, que le soutien exclusif en faveur des organisations pour le développement économique ne réussit pas à encourager la création de nouvelles entreprises en zone rurale. Esprit d'entreprise?Création de petites entreprises?Régions périphériques?Suisse?Engagement municipal?Organisations bénévoles?Capital social Schulz T. und Baumgartner D. Freiwilligenorganisationen: Chance oder Hindernis für Unternehmensgründungen im ländlichen Raum? Evidenz aus Schweizer Gemeinden, Regional Studies. Ländliche Entwicklungsstrategien zielen oft darauf ab, Unternehmensgründungen zu fördern, beispielsweise durch die Unterstützung lokaler, auf die wirtschaftliche Entwicklung gerichteter Organisationen. Basierend auf Umfragedaten aus 254 ländlichen Schweizer Gemeinden untersucht dieser Beitrag den Einfluss verschiedener Typen von Freiwilligenorganisationen auf Unternehmensgründungen mittels einer ?zero-inflated? Poisson-Regression. Die Ergebnisse zeigen, dass eine höhere Zahl von Freiwilligenorganisationen die Anzahl der Unternehmensgründungen generell positiv beeinflusst. Allerdings führt eine zu hohe Zahl ?abgrenzender? und auf die wirtschaftliche Entwicklung fokussierter Organisationen zu weniger Unternehmensgründungen. Die ausschliessliche Förderung von Organisationen für wirtschaftliche Entwicklung ist daher zur Unterstützung von Unternehmensgründungen im ländlichen Raum nicht effektiv. Unternehmertum?Unternehmensgründungen?Nichtkernregionen?Schweiz?Bürgerbeteiligung?Freiwilligenorganisation?Sozialkapital Schulz T. y Baumgartner D. Organizaciones de voluntarios: ¿oportunidades u obstáculos para la creación de pequeños negocios en áreas rurales? Ejemplos de municipios de Suiza, Regional Studies. Las estrategias del desarrollo rural pretenden muchas veces estimular la formación de nuevas empresas, por ejemplo, apoyando a organizaciones de voluntarios localmente activas para el desarrollo económico. Basándonos en los datos recabados en estudios sobre 254 municipios suizos de áreas rurales, en este artículo analizamos cómo influyen los diferentes tipos de organizaciones de voluntarios en la formación de nuevas empresas al aplicar el modelo de regresión de Poisson con ceros aumentados. Los resultados indican que, en general, el hecho de que exista un mayor número de organizaciones de voluntarios influye positivamente en la formación de empresas locales. Sin embargo, un número demasiado alto de asociaciones delimitadas para el desarrollo económico conduce a una disminución en la creación de empresas. Por consiguiente, el apoyo exclusivo de las organizaciones para el desarrollo económico no es eficaz para estimular la formación de nuevas empresas en áreas rurales. Empresariado?Creación de pequeños negocios?Regiones no centrales?Suiza?Compromiso cívico?Organización de voluntarios?Capital social Schulz T. and Baumgartner D. Volunteer organizations: odds or obstacle for small business formation in rural areas? Evidence from Swiss municipalities, Regional Studies. Rural development strategies often claim to stimulate new firm foundations, for example, by supporting locally active volunteer organizations for economic development. Based on survey data from 254 rural Swiss municipalities, this paper analyses the influence of different types of volunteer organizations on new firm foundations by applying a zero-inflated Poisson regression approach. The results suggest that, generally, a higher number of volunteer organizations positively influence the foundation of local firms. Too many ?bonding? associations for economic development, however, lead to decreasing foundations. Exclusive support of organizations for economic development is thus not effective for stimulating new firm foundations in rural areas. Schulz T. and Baumgartner D. ??????????????????????????????????????????????????????????????????????????????????? 254 ????????????????????????????????????????????????????????????????????????????????????????????????????????????????????????????????????????????? ???????????????????????????????? Schulz T. et Baumgartner D. Les organisations bénévoles: des atouts ou des inconvénients pour la création des petites entreprises en zone rurale? Des preuves provenant des municipalités suisses, Regional Studies. La politique d'aménagement du territoire en faveur des zones rurales prétend souvent encourager la création d'entreprise, par exemple, en soutenant des organisations bénévoles pour le développement économique qui jouent un rôle actif sur le plan local. Puisant dans des enquêtes auprès de 254 municipalités rurales suisses, cet article cherche à analyser l'influence de divers genres d'organisations bénévoles sur la création de nouvelles entreprises en appliquant une régression du type Poisson d'ordre zéro. En règle générale, les résultats laissent supposer qu'un nombre non-négligeable d'organisations bénévoles influent de façon positive sur la création d'entreprises locales. Cependant, trop d'organisations ?affectives? pour le développement économique entraînent une baisse du nombre d?établissements. Il s'avère, donc, que le soutien exclusif en faveur des organisations pour le développement économique ne réussit pas à encourager la création de nouvelles entreprises en zone rurale. Esprit d'entreprise?Création de petites entreprises?Régions périphériques?Suisse?Engagement municipal?Organisations bénévoles?Capital social Schulz T. und Baumgartner D. Freiwilligenorganisationen: Chance oder Hindernis für Unternehmensgründungen im ländlichen Raum? Evidenz aus Schweizer Gemeinden, Regional Studies. Ländliche Entwicklungsstrategien zielen oft darauf ab, Unternehmensgründungen zu fördern, beispielsweise durch die Unterstützung lokaler, auf die wirtschaftliche Entwicklung gerichteter Organisationen. Basierend auf Umfragedaten aus 254 ländlichen Schweizer Gemeinden untersucht dieser Beitrag den Einfluss verschiedener Typen von Freiwilligenorganisationen auf Unternehmensgründungen mittels einer ?zero-inflated? Poisson-Regression. Die Ergebnisse zeigen, dass eine höhere Zahl von Freiwilligenorganisationen die Anzahl der Unternehmensgründungen generell positiv beeinflusst. Allerdings führt eine zu hohe Zahl ?abgrenzender? und auf die wirtschaftliche Entwicklung fokussierter Organisationen zu weniger Unternehmensgründungen. Die ausschliessliche Förderung von Organisationen für wirtschaftliche Entwicklung ist daher zur Unterstützung von Unternehmensgründungen im ländlichen Raum nicht effektiv. Unternehmertum?Unternehmensgründungen?Nichtkernregionen?Schweiz?Bürgerbeteiligung?Freiwilligenorganisation?Sozialkapital Schulz T. y Baumgartner D. Organizaciones de voluntarios: ¿oportunidades u obstáculos para la creación de pequeños negocios en áreas rurales? Ejemplos de municipios de Suiza, Regional Studies. Las estrategias del desarrollo rural pretenden muchas veces estimular la formación de nuevas empresas, por ejemplo, apoyando a organizaciones de voluntarios localmente activas para el desarrollo económico. Basándonos en los datos recabados en estudios sobre 254 municipios suizos de áreas rurales, en este artículo analizamos cómo influyen los diferentes tipos de organizaciones de voluntarios en la formación de nuevas empresas al aplicar el modelo de regresión de Poisson con ceros aumentados. Los resultados indican que, en general, el hecho de que exista un mayor número de organizaciones de voluntarios influye positivamente en la formación de empresas locales. Sin embargo, un número demasiado alto de asociaciones delimitadas para el desarrollo económico conduce a una disminución en la creación de empresas. Por consiguiente, el apoyo exclusivo de las organizaciones para el desarrollo económico no es eficaz para estimular la formación de nuevas empresas en áreas rurales. Empresariado?Creación de pequeños negocios?Regiones no centrales?Suiza?Compromiso cívico?Organización de voluntarios?Capital social",doi: 10.1080/00343404.2011.587799,,,
7,,,"Tsourtou, Vasiliki; Hatzinikolaou, Korina & Chatzinikolaou, Christina","Action research with children and adolescents working on the streets of Athens, Greece",Development in Practice,24,3,April,313--326,2014,,,http://dx.doi.org/10.1080/09614524.2014.899996,Development in Practice,,,,,Routledge,,,,,,,"In fieldwork with children and adolescents working on the streets of Athens, Greece, the authors applied a multidisciplinary methodology, through which participants were empowered to articulate their own voice. This article discusses some indicant themes which emerged through participants' narrations and through their active engagement in Theatre-for-Development: (1) the role of family attachment and social networks promoting the continuity of children's cultural identity; (2) their perception of working on the streets as a vital need to contribute to family income; and (3) the way young subjects resituated themselves both in their relation with the mainstream culture and within their own culture. In fieldwork with children and adolescents working on the streets of Athens, Greece, the authors applied a multidisciplinary methodology, through which participants were empowered to articulate their own voice. This article discusses some indicant themes which emerged through participants' narrations and through their active engagement in Theatre-for-Development: (1) the role of family attachment and social networks promoting the continuity of children's cultural identity; (2) their perception of working on the streets as a vital need to contribute to family income; and (3) the way young subjects resituated themselves both in their relation with the mainstream culture and within their own culture.",doi: 10.1080/09614524.2014.899996,,,
7,,,"Wade, Alex","Dots, fruit, speed and pills: the Happy Consciousness of Pac-Man",Journal for Cultural Research,19,3,July,248--261,2015,,,http://dx.doi.org/10.1080/14797585.2015.1021991,Journal for Cultural Research,,,,,Routledge,,,,,,,"Spanning 30 years and 40 individual videogames across a range of platforms, Pac-Man is one of the most recognizable of all videogame characters and a pop?culture icon. In spite of its widespread popularity, the game receives little sustained academic engagement or analysis. In an attempt to address this, the paper argues that in its classic iterations Pac-Man generates complex notions of space and time which are indicative of changing cultural, ethical and political considerations in wider society. This is explored through recourse to Borges? work on labyrinths, Bauman?s discussion of the ethical position of videogames, Poole?s rejoinder and Ritzer?s critique of consumerism, ultimately arguing that the dynamics, themes and leitmotifs evident in Pac-Man are experienced by gamers, consumers and citizens described in Marcuse?s One Dimensional Society, whereby the welfare and warfare state coalesce to generate the Happy Consciousness. Spanning 30 years and 40 individual videogames across a range of platforms, Pac-Man is one of the most recognizable of all videogame characters and a pop?culture icon. In spite of its widespread popularity, the game receives little sustained academic engagement or analysis. In an attempt to address this, the paper argues that in its classic iterations Pac-Man generates complex notions of space and time which are indicative of changing cultural, ethical and political considerations in wider society. This is explored through recourse to Borges? work on labyrinths, Bauman?s discussion of the ethical position of videogames, Poole?s rejoinder and Ritzer?s critique of consumerism, ultimately arguing that the dynamics, themes and leitmotifs evident in Pac-Man are experienced by gamers, consumers and citizens described in Marcuse?s One Dimensional Society, whereby the welfare and warfare state coalesce to generate the Happy Consciousness.",doi: 10.1080/14797585.2015.1021991,,,
