BibliographyType,ISBN,Identifier,Author,Title,Journal,Volume,Number,Month,Pages,Year,Address,Note,URL,Booktitle,Chapter,Edition,Series,Editor,Publisher,ReportType,Howpublished,Institution,Organizations,School,Annote,Abstract,Custom2,Custom3,Custom4,Custom5
7,,,"Haste, Helen",What is ‘competence’ and how should education incorporate new technology's tools to generate ‘competent civic agents’,The Curriculum Journal,20,3,September,207--223,2009,,,http://dx.doi.org/10.1080/09585170903195845,The Curriculum Journal,,,,,Routledge,,,,,,,"This article addresses the competences needed in twenty-first-century life, especially in relation to civic participation, and the educational requirements to foster them in young people. New technologies are widely used by young people for informal social interaction, video game-playing and giving voice to their views. Incorporation of these practices into the classroom has been fairly slow, despite their manifest potential for promoting agency and civic engagement. The article argues that this is in part due to the need for a cultural shift in education to accommodate them. Currently, many competences young people will need for the future world of interactive technology and ?bottom-up? information, communication and democracy are mainly being developed through informal practices. These competences, which include adaptability, managing ambiguity and agency are discussed in relation to civic participation. This article addresses the competences needed in twenty-first-century life, especially in relation to civic participation, and the educational requirements to foster them in young people. New technologies are widely used by young people for informal social interaction, video game-playing and giving voice to their views. Incorporation of these practices into the classroom has been fairly slow, despite their manifest potential for promoting agency and civic engagement. The article argues that this is in part due to the need for a cultural shift in education to accommodate them. Currently, many competences young people will need for the future world of interactive technology and ?bottom-up? information, communication and democracy are mainly being developed through informal practices. These competences, which include adaptability, managing ambiguity and agency are discussed in relation to civic participation.",doi: 10.1080/09585170903195845,,,
7,,,"Hoffman, Lindsay H.",Participation or Communication? An Explication of Political Activity in the Internet Age,Journal of Information Technology & Politics,9,3,July,217--233,2012,,,http://dx.doi.org/10.1080/19331681.2011.650929,Journal of Information Technology & Politics,,,,,Routledge,,,,,,,"ABSTRACT This study clarifies the differences between political participation and political communication online. Although many studies have examined the nature and effects of online activity, none has effectively distinguished between the two types of behavior. This lack of clarity has arguably led to conflicting findings and confusion about what demarks a truly participatory act online. Using Pew 2008 data, online political behaviors are defined and examined. Results suggest that online communication and participation do appear to be different constructs, and while online participation predicts voting, online communication does not. Implications for conceptualizing these behaviors and directions for future research are discussed. This manuscript utilizes publicly available data from the Pew Internet & American Life Project. The data are available at http://www.pewInternet.org/Shared-Content/Data-Sets/2008/November-2008-Post-Election.aspx, and SPSS syntax is available from the author upon request. ABSTRACT This study clarifies the differences between political participation and political communication online. Although many studies have examined the nature and effects of online activity, none has effectively distinguished between the two types of behavior. This lack of clarity has arguably led to conflicting findings and confusion about what demarks a truly participatory act online. Using Pew 2008 data, online political behaviors are defined and examined. Results suggest that online communication and participation do appear to be different constructs, and while online participation predicts voting, online communication does not. Implications for conceptualizing these behaviors and directions for future research are discussed. This manuscript utilizes publicly available data from the Pew Internet & American Life Project. The data are available at http://www.pewInternet.org/Shared-Content/Data-Sets/2008/November-2008-Post-Election.aspx, and SPSS syntax is available from the author upon request.",doi: 10.1080/19331681.2011.650929,,,
7,,,"Hollander, Justin B.",Intelligent participation: engaging citizens through a framework of multiple intelligences,Community Development,43,3,July,346--360,2012,,,http://dx.doi.org/10.1080/15575330.2011.621086,Community Development,,,,,Routledge,,,,,,,"Community development professionals tend to treat the public as monolithic and homogeneous, without respect for variation in types of intelligence among the citizenry. This research explored how the psychological concept of multiple intelligences can be used to enhance public participation in a public planning process. The research involved the development of a model of public participation grounded in the theory of multiple intelligence and a case study of the application of that model in a town outside of Boston. The findings support the premise that a multiple intelligence framework can bring in and elicit input from a broad and intellectually diverse subset of the population. Community development professionals tend to treat the public as monolithic and homogeneous, without respect for variation in types of intelligence among the citizenry. This research explored how the psychological concept of multiple intelligences can be used to enhance public participation in a public planning process. The research involved the development of a model of public participation grounded in the theory of multiple intelligence and a case study of the application of that model in a town outside of Boston. The findings support the premise that a multiple intelligence framework can bring in and elicit input from a broad and intellectually diverse subset of the population.",doi: 10.1080/15575330.2011.621086,,,
7,,,"Horelli, Liisa; Saad-Sulonen, Joanna; Wallin, Sirkku & Botero, Andrea",When Self-Organization Intersects with Urban Planning: Two Cases from Helsinki,Planning Practice & Research,30,3,May,286--302,2015,,,http://dx.doi.org/10.1080/02697459.2015.1052941,Planning Practice & Research,,,,,Routledge,,,,,,,"Participation as self-organization has emerged as a new form of citizen activism, often supported by digital technology. A comparative qualitative analysis of two case studies in Helsinki indicates that the self-organization of citizens expands the practice of urban planning. Together, they enable the mobilization of different groups around issues related to urban space. The consequences have become visible in temporary uses of places, event making and community development through bottom-up cultures. However, the lacking links to decision-making constrains new solutions and creative actions. Participation as self-organization has emerged as a new form of citizen activism, often supported by digital technology. A comparative qualitative analysis of two case studies in Helsinki indicates that the self-organization of citizens expands the practice of urban planning. Together, they enable the mobilization of different groups around issues related to urban space. The consequences have become visible in temporary uses of places, event making and community development through bottom-up cultures. However, the lacking links to decision-making constrains new solutions and creative actions.",doi: 10.1080/02697459.2015.1052941,,,
7,,,"Iorio, Josh; Taylor, John E. & Sturts Dossick, Carrie",A bridge too far: examining the impact of facilitators on information transfer in global virtual project networks,Engineering Project Organization Journal,2,4,December,188--201,2012,,,http://dx.doi.org/10.1080/21573727.2011.642478,Engineering Project Organization Journal,,,,,Taylor & Francis,,,,,,,"As the architecture, engineering and construction industry globalizes and the use of virtual environments to connect this workforce becomes more common, it becomes increasingly important to understand how to best support efficient systems of information transfer in technologically mediated workspaces. Previous research has demonstrated that global project networks face technological challenges that can interfere with collaboration, and it has been argued that facilitators are an effective means to help networks overcome these challenges. We conducted a study to determine how facilitators impact the transfer of information through a global project network in a modally robust virtual workspace by examining the centrality of facilitators and actors from different knowledge domains. We used task conflict duration as an outcome variable in comparing the performance of two facilitated and two non-facilitated networks of student teams engaged in complex design and planning projects. Our findings indicate that when facilitators occupied highly central positions during task interactions, conflict length was observed to increase. In non-facilitated networks, highly central actors emerged from a variety of knowledge domains and conflict length was observed to decrease. This evidence suggests that while facilitators are typically viewed as information bridges in global project networks, when they are central to task discussions, facilitators may impede the development of efficient network structures. As the architecture, engineering and construction industry globalizes and the use of virtual environments to connect this workforce becomes more common, it becomes increasingly important to understand how to best support efficient systems of information transfer in technologically mediated workspaces. Previous research has demonstrated that global project networks face technological challenges that can interfere with collaboration, and it has been argued that facilitators are an effective means to help networks overcome these challenges. We conducted a study to determine how facilitators impact the transfer of information through a global project network in a modally robust virtual workspace by examining the centrality of facilitators and actors from different knowledge domains. We used task conflict duration as an outcome variable in comparing the performance of two facilitated and two non-facilitated networks of student teams engaged in complex design and planning projects. Our findings indicate that when facilitators occupied highly central positions during task interactions, conflict length was observed to increase. In non-facilitated networks, highly central actors emerged from a variety of knowledge domains and conflict length was observed to decrease. This evidence suggests that while facilitators are typically viewed as information bridges in global project networks, when they are central to task discussions, facilitators may impede the development of efficient network structures.",doi: 10.1080/21573727.2011.642478,,,
7,,,"Iosifidis, Petros","THE PUBLIC SPHERE, SOCIAL NETWORKS AND PUBLIC SERVICE MEDIA","Information, Communication & Society",14,5,August,619--637,2011,,,http://www.tandfonline.com/doi/abs/10.1080/1369118X.2010.514356,"Information, Communication & Society",,,,,Routledge,,,,,,,"The traditional Habermasian concept of the national public sphere created by the mass media of newspapers and television is said to have transformed to a multi-layered sphere of online and social networks which are increasingly important in engaging and mobilizing citizenship and in shaping the discourse within which rational discussion takes place. This article argues that the democratizing and empowering functions of the Internet and the new social media is being exaggerated and represent technological optimism for a number of reasons: the open participation of the Internet can turn chaotic; there is a problem of inclusiveness; censorship might be an issue; the Internet has become a major arena for corporate activity; the Internet's content is highly partisan; and above all, extensive dialogue and critical discussion (the very essence of the public sphere) is often absent on the Net. The article argues that open-platform Public Service Media (PSM) are capable of developing more comprehensive and inclusive social frameworks than online providers. Despite the growing financial gulf between PSM and their commercial competitors, public institutions should be free to expand online and into different platforms. As trusted media brands, PSM contribute to the creation of an inclusive public sphere, enhanced civic engagement and informed citizenship. The traditional Habermasian concept of the national public sphere created by the mass media of newspapers and television is said to have transformed to a multi-layered sphere of online and social networks which are increasingly important in engaging and mobilizing citizenship and in shaping the discourse within which rational discussion takes place. This article argues that the democratizing and empowering functions of the Internet and the new social media is being exaggerated and represent technological optimism for a number of reasons: the open participation of the Internet can turn chaotic; there is a problem of inclusiveness; censorship might be an issue; the Internet has become a major arena for corporate activity; the Internet's content is highly partisan; and above all, extensive dialogue and critical discussion (the very essence of the public sphere) is often absent on the Net. The article argues that open-platform Public Service Media (PSM) are capable of developing more comprehensive and inclusive social frameworks than online providers. Despite the growing financial gulf between PSM and their commercial competitors, public institutions should be free to expand online and into different platforms. As trusted media brands, PSM contribute to the creation of an inclusive public sphere, enhanced civic engagement and informed citizenship.",doi: 10.1080/1369118X.2010.514356,,,
7,,,"Jarman, Holly",Collaboration and Consultation: Functional Representation in EU Stakeholder Dialogues,Journal of European Integration,33,4,July,385--399,2011,,,http://dx.doi.org/10.1080/07036337.2011.579748,Journal of European Integration,,,,,Routledge,,,,,,,"Abstract In the past decade, the EU has experimented with various types of consultation mechanisms intended to address perceived deficits in policy knowledge and decision-making legitimacy within the European system. I examine attempts by the European Commission to build up its decision-making legitimacy and inform policy via various formal mechanisms, focusing on the extent to which the relationship between the Commission and its civil society groups is collaborative or consultative. In particular, I examine two such experiments: The DG Trade Civil Society Dialogue (CSD) and the DG SANCO platform on Diet, Physical Activity and Health. DG Trade, a strong and relatively autonomous DG, developed a consultative model of engagement, gaining legitimation by consulting with advocacy groups. DG SANCO, working in areas where the EU competencies are weak, adopts a collaborative model in which it can set the agenda and structure debates but fundamentally depends on industry association partners, rather than its own legal powers, to achieve its goals. Abstract In the past decade, the EU has experimented with various types of consultation mechanisms intended to address perceived deficits in policy knowledge and decision-making legitimacy within the European system. I examine attempts by the European Commission to build up its decision-making legitimacy and inform policy via various formal mechanisms, focusing on the extent to which the relationship between the Commission and its civil society groups is collaborative or consultative. In particular, I examine two such experiments: The DG Trade Civil Society Dialogue (CSD) and the DG SANCO platform on Diet, Physical Activity and Health. DG Trade, a strong and relatively autonomous DG, developed a consultative model of engagement, gaining legitimation by consulting with advocacy groups. DG SANCO, working in areas where the EU competencies are weak, adopts a collaborative model in which it can set the agenda and structure debates but fundamentally depends on industry association partners, rather than its own legal powers, to achieve its goals.",doi: 10.1080/07036337.2011.579748,,,
7,,,"Kollmann, Elizabeth Kunz; Reich, Christine; Bell, Larry & Goss, Juli",Tackling Tough Topics: Using Socio-Scientific Issues to Help Museum Visitors Participate in Democratic Dialogue and Increase Their Understandings of Current Science and Technology,Journal of Museum Education,38,2,July,174--186,2013,,,http://dx.doi.org/10.1080/10598650.2013.11510768,Journal of Museum Education,,,,,Routledge,,,,,,,"AbstractIn a world of increasing scientific and technological complexity, where science and technology play an expanding role in our lives, there is need for a democratic citizenry that is skilled at discussing and making choices that are informed by science and shaped by individual and collective values. Although an oft argued rationale for teaching science is the need for informed citizens, few have connected science education goals to democratic dialogue. At the Museum of Science, taking on this task?to promote democratic dialogue and teach the public about current science and technology?has meant a change in our approach to science education over the past decade. We know that creating an informed citizenry prepared to address today's challenges requires educating the public about cutting edge science and technology research connected to the issues of the day, but it also requires moving beyond a public understanding of science model to a public engagement with science model in which the public's expertise, values, and personal experience are respected, explored, and discussed. Socio-scientific topics ranging from ?Under what conditions should nanotechnology in medicine and personal care products be made available to the public?? to ?Should parents be able make decisions about their future child based upon their genetic sequence?? have proven to be an effective means to achieve the goals of public engagement mode. In the projects detailed here, we show how and why they also prove effective as a means by which science museums can promote democratic dialogue and learning about current science and technology. AbstractIn a world of increasing scientific and technological complexity, where science and technology play an expanding role in our lives, there is need for a democratic citizenry that is skilled at discussing and making choices that are informed by science and shaped by individual and collective values. Although an oft argued rationale for teaching science is the need for informed citizens, few have connected science education goals to democratic dialogue. At the Museum of Science, taking on this task?to promote democratic dialogue and teach the public about current science and technology?has meant a change in our approach to science education over the past decade. We know that creating an informed citizenry prepared to address today's challenges requires educating the public about cutting edge science and technology research connected to the issues of the day, but it also requires moving beyond a public understanding of science model to a public engagement with science model in which the public's expertise, values, and personal experience are respected, explored, and discussed. Socio-scientific topics ranging from ?Under what conditions should nanotechnology in medicine and personal care products be made available to the public?? to ?Should parents be able make decisions about their future child based upon their genetic sequence?? have proven to be an effective means to achieve the goals of public engagement mode. In the projects detailed here, we show how and why they also prove effective as a means by which science museums can promote democratic dialogue and learning about current science and technology.",doi: 10.1080/10598650.2013.11510768,,,
7,,,"Krishnan, Archana; Ferro, Enrico G.; Weikum, Damian; Vagenas, Panagiotis; Lama, Javier R.; Sanchez, Jorge & Altice, Frederick L.",Communication technology use and mHealth acceptance among HIV-infected men who have sex with men in Peru: implications for HIV prevention and treatment,AIDS Care,27,3,March,273--282,2015,,,http://dx.doi.org/10.1080/09540121.2014.963014,AIDS Care,,,,,Taylor & Francis,,,,,,,"The HIV epidemic in Peru is concentrated among men who have sex with men (MSM). Given that MSM have been documented as early adopters of emerging technology, we examined communication technology access and utilization, and mobile health (mHealth) acceptance among Peruvian MSM and transgender women (TGW) in order to gauge opportunities for mHealth-enabled HIV interventions. A convenience sample of 359 HIV-infected MSM and TGW recruited from three sites in Lima, Peru completed standardized assessments of alcohol use disorders (AUDs), risky sexual behavior, and antiretroviral therapy (ART) adherence along with self-constructed measures of communication technology access and utilization, and mHealth acceptance. Most participants (86%) had daily access to any cell phone, including smartphones (30%). The most frequent communication activities were receiving and making calls, and receiving and sending text messages using cell phones. On a 5-point Likert scale, participants expressed interest in using mHealth for medication reminders (M = 3.21, SD = 1.32) and engaging in anonymous online interactions with health professionals to discuss HIV-related issues (M = 3.56, SD = 1.33). Importantly, no significant differences were found in communication technology use and mHealth acceptance among participants with AUDs, depression, and suboptimal ART adherence, all of which are associated with poor HIV treatment outcomes. Findings show support for implementing mHealth-based intervention strategies using cell phones to assess and reduce HIV-risk behaviors among HIV-infected MSM and TGW. The HIV epidemic in Peru is concentrated among men who have sex with men (MSM). Given that MSM have been documented as early adopters of emerging technology, we examined communication technology access and utilization, and mobile health (mHealth) acceptance among Peruvian MSM and transgender women (TGW) in order to gauge opportunities for mHealth-enabled HIV interventions. A convenience sample of 359 HIV-infected MSM and TGW recruited from three sites in Lima, Peru completed standardized assessments of alcohol use disorders (AUDs), risky sexual behavior, and antiretroviral therapy (ART) adherence along with self-constructed measures of communication technology access and utilization, and mHealth acceptance. Most participants (86%) had daily access to any cell phone, including smartphones (30%). The most frequent communication activities were receiving and making calls, and receiving and sending text messages using cell phones. On a 5-point Likert scale, participants expressed interest in using mHealth for medication reminders (M = 3.21, SD = 1.32) and engaging in anonymous online interactions with health professionals to discuss HIV-related issues (M = 3.56, SD = 1.33). Importantly, no significant differences were found in communication technology use and mHealth acceptance among participants with AUDs, depression, and suboptimal ART adherence, all of which are associated with poor HIV treatment outcomes. Findings show support for implementing mHealth-based intervention strategies using cell phones to assess and reduce HIV-risk behaviors among HIV-infected MSM and TGW.",doi: 10.1080/09540121.2014.963014,,,
