BibliographyType,ISBN,Identifier,Author,Title,Journal,Volume,Number,Month,Pages,Year,Address,Note,URL,Booktitle,Chapter,Edition,Series,Editor,Publisher,ReportType,Howpublished,Institution,Organizations,School,Annote,Abstract,Custom2,Custom3,Custom4,Custom5
7,,,"Group, The E‐Science Directors' Forum Strategy Working; Atkinson, Malcolm; Britton, David; Coveney, Peter; De Roure, David; Garnett, Ned; Geddes, Neil; Gurney, Robert; Haines, Keith; Hughes, Lorna; Ingram, David; Jeffreys, Paul; Lyon, Liz; Osborne, Ian; Perrott, Ron; Procter, Rob; Rusbridge, Chris; Trefethen, Anne & Watson, Paul",Century‐of‐Information Research (CIR): A Strategy for Research and Innovation in the Century of Information,Prometheus,27,1,March,27--45,2009,,,http://dx.doi.org/10.1080/08109020802657479,Prometheus,,,,,Routledge,,,,,,,"Abstract More data will be produced in the next five years than in the entire history of human kind, a digital deluge that marks the beginning of the Century of Information. Through a year?long consultation with UK researchers, a coherent strategy has been developed, which will nurture Century?of?Information Research (CIR); it crystallises the ideas developed by the e?Science Directors? Forum Strategy Working Group. This paper is an abridged version of their latest report which can be found at: http://wikis.nesc.ac.uk/escienvoy/Century_of_Information_Research_Strategy which also records the consultation process and the affiliations of the authors. This document is derived from a paper presented at the Oxford e?Research Conference 2008 and takes into account suggestions made in the ensuing panel discussion. The goals of the CIR Strategy are to facilitate the growth of UK research and innovation that is data and computationally intensive and to develop a new culture of ?digital?systems judgement? that will equip research communities, businesses, government and society as a whole, with the skills essential to compete and prosper in the Century of Information. The CIR Strategy identifies a national requirement for a balanced programme of coordination, research, infrastructure, translational investment and education to empower UK researchers, industry, government and society. The Strategy is designed to deliver an environment which meets the needs of UK researchers so that they can respond agilely to challenges, can create knowledge and skills, and can lead new kinds of research. It is a call to action for those engaged in research, those providing data and computational facilities, those governing research and those shaping education policies. The ultimate aim is to help researchers strengthen the international competitiveness of the UK research base and increase its contribution to the economy. The objectives of the Strategy are to better enable UK researchers across all disciplines to contribute world?leading fundamental research; to accelerate the translation of research into practice; and to develop improved capabilities, facilities and context for research and innovation. It envisages a culture that is better able to grasp the opportunities provided by the growing wealth of digital information. Computing has, of course, already become a fundamental tool in all research disciplines. The UK e?Science programme (2001?06)?since emulated internationally?pioneered the invention and use of new research methods, and a new wave of innovations in digital?information technologies which have enabled them. The Strategy argues that the UK must now harness and leverage its own, plus the now global, investment in digital?information technology in order to spread the benefits as widely as possible in research, education, industry and government. Implementing the Strategy would deliver the computational infrastructure and its benefits as envisaged in the Science  provide easily used, pervasive and sustained e?Infrastructure for all research; enlarge the productive research community which exploits the new methods efficiently; generate capacity, propagate knowledge and develop skills via new curricula; and develop coordination mechanisms to improve the opportunities for interdisciplinary research and to make digital?infrastructure provision more cost effective. To gain the best value for money strategic coordination is required across a broad spectrum of stakeholders. A coherent strategy is essential in order to establish and sustain the UK as an international leader of well?curated national data assets and computational infrastructure, which is expertly used to shape policy, support decisions, empower researchers and to roll out the results to the wider benefit of society. The value of data as a foundation for wellbeing and a sustainable society must be appreciated; national resources must be more wisely directed to the collection, curation, discovery, widening access, analysis and exploitation of these data. Every researcher must be able to draw on skills, tools and computational resources to develop insights, test hypotheses and translate inventions into productive use, or to extract knowledge in support of governmental decision making. This foundation plus the skills developed will launch significant advances in research, in business, in professional practice and in government with many consequent benefits for UK citizens. The Strategy presented here addresses these complex and interlocking requirements. Abstract More data will be produced in the next five years than in the entire history of human kind, a digital deluge that marks the beginning of the Century of Information. Through a year?long consultation with UK researchers, a coherent strategy has been developed, which will nurture Century?of?Information Research (CIR); it crystallises the ideas developed by the e?Science Directors? Forum Strategy Working Group. This paper is an abridged version of their latest report which can be found at: http://wikis.nesc.ac.uk/escienvoy/Century_of_Information_Research_Strategy which also records the consultation process and the affiliations of the authors. This document is derived from a paper presented at the Oxford e?Research Conference 2008 and takes into account suggestions made in the ensuing panel discussion. The goals of the CIR Strategy are to facilitate the growth of UK research and innovation that is data and computationally intensive and to develop a new culture of ?digital?systems judgement? that will equip research communities, businesses, government and society as a whole, with the skills essential to compete and prosper in the Century of Information. The CIR Strategy identifies a national requirement for a balanced programme of coordination, research, infrastructure, translational investment and education to empower UK researchers, industry, government and society. The Strategy is designed to deliver an environment which meets the needs of UK researchers so that they can respond agilely to challenges, can create knowledge and skills, and can lead new kinds of research. It is a call to action for those engaged in research, those providing data and computational facilities, those governing research and those shaping education policies. The ultimate aim is to help researchers strengthen the international competitiveness of the UK research base and increase its contribution to the economy. The objectives of the Strategy are to better enable UK researchers across all disciplines to contribute world?leading fundamental research; to accelerate the translation of research into practice; and to develop improved capabilities, facilities and context for research and innovation. It envisages a culture that is better able to grasp the opportunities provided by the growing wealth of digital information. Computing has, of course, already become a fundamental tool in all research disciplines. The UK e?Science programme (2001?06)?since emulated internationally?pioneered the invention and use of new research methods, and a new wave of innovations in digital?information technologies which have enabled them. The Strategy argues that the UK must now harness and leverage its own, plus the now global, investment in digital?information technology in order to spread the benefits as widely as possible in research, education, industry and government. Implementing the Strategy would deliver the computational infrastructure and its benefits as envisaged in the Science  provide easily used, pervasive and sustained e?Infrastructure for all research; enlarge the productive research community which exploits the new methods efficiently; generate capacity, propagate knowledge and develop skills via new curricula; and develop coordination mechanisms to improve the opportunities for interdisciplinary research and to make digital?infrastructure provision more cost effective. To gain the best value for money strategic coordination is required across a broad spectrum of stakeholders. A coherent strategy is essential in order to establish and sustain the UK as an international leader of well?curated national data assets and computational infrastructure, which is expertly used to shape policy, support decisions, empower researchers and to roll out the results to the wider benefit of society. The value of data as a foundation for wellbeing and a sustainable society must be appreciated; national resources must be more wisely directed to the collection, curation, discovery, widening access, analysis and exploitation of these data. Every researcher must be able to draw on skills, tools and computational resources to develop insights, test hypotheses and translate inventions into productive use, or to extract knowledge in support of governmental decision making. This foundation plus the skills developed will launch significant advances in research, in business, in professional practice and in government with many consequent benefits for UK citizens. The Strategy presented here addresses these complex and interlocking requirements.",doi: 10.1080/08109020802657479,,,
7,,,"Hegarty, Joseph A.",Achieving Excellence by Means of Critical Reflection and Cultural Imagination in Culinary Arts and Gastronomy Education,Journal of Culinary Science & Technology,9,2,April,55--65,2011,,,http://dx.doi.org/10.1080/15428052.2011.580705,Journal of Culinary Science & Technology,,,,,Taylor & Francis,,,,,,,"This article aims to demonstrate that in raising the discipline of culinary arts and gastronomy beyond the craft/vocational level to under/postgraduate degree level, educators need to become critically reflective and knowledgeable (qualified) and enable students to learn how to learn, to become entrepreneurial and technological innovators, and to lead worthwhile lives as citizens, with a sense of mission and responsibility for the planet and the poor. It draws on a lifetime's study and experience in culinary arts education, transforming craft-based vocational programs into cognitive educational ones, preparing students to become more than cooking operatives, and introducing concepts that establish culinary arts and gastronomy as serious disciplines worthy of full academic status. Critical reflection allows practitioners to think critically about their practices. It allows educators to become critically reflexive practitioners. It facilitates culinary arts and gastronomy students and researchers. It allows them to become resource persons (consultants), offering guidelines and suggesting approaches to critical thinking and problem solving. Critical reflection engages culinary arts and gastronomy students and researchers in exploring the learning?teaching process in a manner that enhances the development of the discipline's knowledge base. It involves both the study of a situation with a view to improving the quality of the action within it and challenging the orthodoxy of traditional methods of education in the field. In short, it is an approach to excellence. In seeking to raise the academic level of culinary, gastronomy, and hospitality education to excellence, lecturers need to enable students to become involved in the assessment process by becoming critically reflective learners. Students must learn how to learn, to assess their own and others' learning through collaborative, peer, and self-assessment processes. This article aims to demonstrate that in raising the discipline of culinary arts and gastronomy beyond the craft/vocational level to under/postgraduate degree level, educators need to become critically reflective and knowledgeable (qualified) and enable students to learn how to learn, to become entrepreneurial and technological innovators, and to lead worthwhile lives as citizens, with a sense of mission and responsibility for the planet and the poor. It draws on a lifetime's study and experience in culinary arts education, transforming craft-based vocational programs into cognitive educational ones, preparing students to become more than cooking operatives, and introducing concepts that establish culinary arts and gastronomy as serious disciplines worthy of full academic status. Critical reflection allows practitioners to think critically about their practices. It allows educators to become critically reflexive practitioners. It facilitates culinary arts and gastronomy students and researchers. It allows them to become resource persons (consultants), offering guidelines and suggesting approaches to critical thinking and problem solving. Critical reflection engages culinary arts and gastronomy students and researchers in exploring the learning?teaching process in a manner that enhances the development of the discipline's knowledge base. It involves both the study of a situation with a view to improving the quality of the action within it and challenging the orthodoxy of traditional methods of education in the field. In short, it is an approach to excellence. In seeking to raise the academic level of culinary, gastronomy, and hospitality education to excellence, lecturers need to enable students to become involved in the assessment process by becoming critically reflective learners. Students must learn how to learn, to assess their own and others' learning through collaborative, peer, and self-assessment processes.",doi: 10.1080/15428052.2011.580705,,,
7,,,"Hooghe, Marc & Oser, Jennifer","Trade union density and social expenditure: a longitudinal analysis of policy feedback effects in OECD countries, 1980-2010",Journal of European Public Policy,,,November,1--23,2015,,,http://dx.doi.org/10.1080/13501763.2015.1102952,Journal of European Public Policy,,,,,Routledge,,,,,,,"ABSTRACTTwo causal mechanisms have been invoked to explain the positive correlation between union membership and social expenditure. Unions try to influence policy, but they are also more successful in mobilizing members in economic systems in which actors engage in co-ordinated strategic interaction. Applying insights from the policy feedback and comparative capitalism literatures, our analysis indicates that union density is a determinant of social expenditure. A strong policy feedback effect is also present whereby social expenditure has a positive effect on union density. We find a positive effect of union density on social expenditure in co-ordinated market economies, but not in liberal market economies. We discuss the implications of these findings for citizens? capacity to influence policy in varied contexts and for the ?varieties of capitalism? literature, and we close with some speculation about the implications of these findings in the current economic downturn. ABSTRACTTwo causal mechanisms have been invoked to explain the positive correlation between union membership and social expenditure. Unions try to influence policy, but they are also more successful in mobilizing members in economic systems in which actors engage in co-ordinated strategic interaction. Applying insights from the policy feedback and comparative capitalism literatures, our analysis indicates that union density is a determinant of social expenditure. A strong policy feedback effect is also present whereby social expenditure has a positive effect on union density. We find a positive effect of union density on social expenditure in co-ordinated market economies, but not in liberal market economies. We discuss the implications of these findings for citizens? capacity to influence policy in varied contexts and for the ?varieties of capitalism? literature, and we close with some speculation about the implications of these findings in the current economic downturn.",doi: 10.1080/13501763.2015.1102952,,,
7,,,"Ioannou, Soula; Kouta, Christiana; Constantinidou, Maria & Ellina, Panayiota",Sexuality education as a collective responsibility: a new health education curriculum in Cyprus,Sex Education,14,4,July,375--386,2014,,,http://dx.doi.org/10.1080/14681811.2014.918031,Sex Education,,,,,Routledge,,,,,,,"The development of health promotion is typically viewed as a reaction against both the excessive responsibility placed on individuals concerning their health-related choices and the absence of recognition of environmental factors associated with personal decision making. What though does sexuality education mean from the perspective of health promotion? According to one approach, it implies the existence of a curriculum that recognises the environmental factors affecting sexuality and sexual behaviour. It also suggests a curriculum that aims to empower students to engage with risky sexual behaviour, not just as a personal issue but also as a social matter. The emphasis is placed not merely on developing personal knowledge and skills associated with sexuality and sexual behaviour but on enabling active citizens to protect themselves and their co-citizens from sexual risks and to promote healthy sexuality. This paper discusses such a health promotion perspective in relation to the sexuality education curriculum as recently developed in Cyprus. It demonstrates how a health promotion perspective in relation to sex education can be translated into the establishment of learning objectives, appropriate pedagogic methods and the development of school materials. The development of health promotion is typically viewed as a reaction against both the excessive responsibility placed on individuals concerning their health-related choices and the absence of recognition of environmental factors associated with personal decision making. What though does sexuality education mean from the perspective of health promotion? According to one approach, it implies the existence of a curriculum that recognises the environmental factors affecting sexuality and sexual behaviour. It also suggests a curriculum that aims to empower students to engage with risky sexual behaviour, not just as a personal issue but also as a social matter. The emphasis is placed not merely on developing personal knowledge and skills associated with sexuality and sexual behaviour but on enabling active citizens to protect themselves and their co-citizens from sexual risks and to promote healthy sexuality. This paper discusses such a health promotion perspective in relation to the sexuality education curriculum as recently developed in Cyprus. It demonstrates how a health promotion perspective in relation to sex education can be translated into the establishment of learning objectives, appropriate pedagogic methods and the development of school materials.",doi: 10.1080/14681811.2014.918031,,,
7,,,"João, Elsa & McLauchlan, Anna",Would you do SEA if you didn't have to?- Reflections on acceptance or rejection of the SEA process,Impact Assessment and Project Appraisal,32,2,April,87--97,2014,,,http://dx.doi.org/10.1080/14615517.2014.889265,Impact Assessment and Project Appraisal,,,,,Taylor & Francis,,,,,,,"Strategic environmental assessment (SEA) is undertaken in more than 60 countries worldwide. Support to the SEA process can range from formal legal requirements to voluntary ?ad hoc? approaches. In the cases where SEA is legally required, such as in Europe where the SEA Directive sets a framework for SEA legislation in 28 countries, practitioners may engage with SEA but in a reluctant way. This paper reports on a unique survey of 203 key people responsible for implementing the SEA legislative requirement in Scotland. The majority (53%) of the 187 practitioners who answered the hypothetical question ?If SEA was not compulsory, would you do it?? said ?Yes?. However, results suggest that the responses were much nuanced. Practitioners were asked to explicate their reasoning and, irrespective of whether the answer was ?yes? or ?no?, common themes were evident in accompanying remarks. This paper enables reflection on reasons for acceptance or rejection of the SEA process by discussing: the perception that a similar process to SEA is already being done, the problem with lack of resources, the call for a ?leaner process? and the difficulties of undertaking SEA when conditions are already determined at a higher ?tier?. Strategic environmental assessment (SEA) is undertaken in more than 60 countries worldwide. Support to the SEA process can range from formal legal requirements to voluntary ?ad hoc? approaches. In the cases where SEA is legally required, such as in Europe where the SEA Directive sets a framework for SEA legislation in 28 countries, practitioners may engage with SEA but in a reluctant way. This paper reports on a unique survey of 203 key people responsible for implementing the SEA legislative requirement in Scotland. The majority (53%) of the 187 practitioners who answered the hypothetical question ?If SEA was not compulsory, would you do it?? said ?Yes?. However, results suggest that the responses were much nuanced. Practitioners were asked to explicate their reasoning and, irrespective of whether the answer was ?yes? or ?no?, common themes were evident in accompanying remarks. This paper enables reflection on reasons for acceptance or rejection of the SEA process by discussing: the perception that a similar process to SEA is already being done, the problem with lack of resources, the call for a ?leaner process? and the difficulties of undertaking SEA when conditions are already determined at a higher ?tier?.",doi: 10.1080/14615517.2014.889265,,,
7,,,"Kobayashi, Tetsuro & Boase, Jeffrey",No Such Effect? The Implications of Measurement Error in Self-Report Measures of Mobile Communication Use,Communication Methods and Measures,6,2,April,126--143,2012,,,http://dx.doi.org/10.1080/19312458.2012.679243,Communication Methods and Measures,,,,,Routledge,,,,,,,"Research on the social and psychological effects of mobile phone communication primarily is conducted using self-report measures of use. However, recent studies have suggested such measures of mobile phone communication use contain a significant amount of measurement error. This study compares the frequency of mobile phone use measured by self-report questions with error-free log data automatically collected through an Android smartphone application. Using data from 310 Android phone users in Japan, we investigate the extent to which nonrandom measurement error exists in self-report responses to questions about mobile phone use and predictors of this error. Our analysis shows that users generally overreport their frequency of mobile communication and that overestimation is better predicted by proxy measures of social activity than demographic variables. We further show an example of how overreporting can result in an overestimation of the effects of mediated communication on civic engagement. Finally, the value of behavioral log data in mediated communication research is discussed. Research on the social and psychological effects of mobile phone communication primarily is conducted using self-report measures of use. However, recent studies have suggested such measures of mobile phone communication use contain a significant amount of measurement error. This study compares the frequency of mobile phone use measured by self-report questions with error-free log data automatically collected through an Android smartphone application. Using data from 310 Android phone users in Japan, we investigate the extent to which nonrandom measurement error exists in self-report responses to questions about mobile phone use and predictors of this error. Our analysis shows that users generally overreport their frequency of mobile communication and that overestimation is better predicted by proxy measures of social activity than demographic variables. We further show an example of how overreporting can result in an overestimation of the effects of mediated communication on civic engagement. Finally, the value of behavioral log data in mediated communication research is discussed.",doi: 10.1080/19312458.2012.679243,,,
