BibliographyType,ISBN,Identifier,Author,Title,Journal,Volume,Number,Month,Pages,Year,Address,Note,URL,Booktitle,Chapter,Edition,Series,Editor,Publisher,ReportType,Howpublished,Institution,Organizations,School,Annote,Abstract,Custom2,Custom3,Custom4,Custom5
7,,,"Johnson, Bonnie J. & Halegoua, Germaine R.",Can Social Media Save a Neighborhood Organization?,Planning Practice & Research,30,3,May,248--269,2015,,,http://dx.doi.org/10.1080/02697459.2015.1051319,Planning Practice & Research,,,,,Routledge,,,,,,,"Positive discourse around social media and civic engagement inspired a neighborhood association with few members and resources to use these services. They hoped to revive the neighborhood association and attract new and younger members. They received five Facebook ?likes? and three Twitter followers out of 550 households. Survey results revealed a mismatch between perceptions of ?neighborly? and social media ties and expectations for neighborhood communication. However, residents most interested in the neighborhood association were those who chose social media for neighborhood outreach, not those choosing email or postal mail. Ultimately, using multiple communication methods is ideal, but targeting residents via social media might be a starting point for planners and resource poor organizations. Positive discourse around social media and civic engagement inspired a neighborhood association with few members and resources to use these services. They hoped to revive the neighborhood association and attract new and younger members. They received five Facebook ?likes? and three Twitter followers out of 550 households. Survey results revealed a mismatch between perceptions of ?neighborly? and social media ties and expectations for neighborhood communication. However, residents most interested in the neighborhood association were those who chose social media for neighborhood outreach, not those choosing email or postal mail. Ultimately, using multiple communication methods is ideal, but targeting residents via social media might be a starting point for planners and resource poor organizations.",doi: 10.1080/02697459.2015.1051319,,,
7,,,"Kivits, Robbert A",Three component stakeholder analysis,International Journal of Multiple Research Approaches,5,3,December,318--333,2011,,,http://dx.doi.org/10.5172/mra.2011.5.3.318,International Journal of Multiple Research Approaches,,,,,Routledge,,,,,,,"AbstractBoth public and private organizations are increasingly employing stakeholder engagement as an important strategy for improving external stakeholder relations. Incorporating stakeholders? opinions is valuable for improving decision-making processes and project implementation [Deelstra, Nooteboom, Kohlmann, van den Berg,  Reed et al. (2009) Who?s in and why? A typology of stakeholder analysis methods for natural resource management. Journal of Environmental Management, 90(5), 1933?1949], has been insufficiently explored. At present, there is no integrated stakeholder analysis method that investigates the stakeholder sufficiently, i.e., from multiple space?time subjectivities, rather then from a single space?time representation. To arrive at an integrated stakeholder analysis methodology, Reed et al. (2009) have suggested investigating the potential for combining existing methods to derive more useful results. This article will therefore offer a new integrated framework, covering all components; salience, frames of reference and networks. AbstractBoth public and private organizations are increasingly employing stakeholder engagement as an important strategy for improving external stakeholder relations. Incorporating stakeholders? opinions is valuable for improving decision-making processes and project implementation [Deelstra, Nooteboom, Kohlmann, van den Berg,  Reed et al. (2009) Who?s in and why? A typology of stakeholder analysis methods for natural resource management. Journal of Environmental Management, 90(5), 1933?1949], has been insufficiently explored. At present, there is no integrated stakeholder analysis method that investigates the stakeholder sufficiently, i.e., from multiple space?time subjectivities, rather then from a single space?time representation. To arrive at an integrated stakeholder analysis methodology, Reed et al. (2009) have suggested investigating the potential for combining existing methods to derive more useful results. This article will therefore offer a new integrated framework, covering all components; salience, frames of reference and networks.",doi: 10.5172/mra.2011.5.3.318,,,
7,,,"Kotilainen, Sirkku & Rantala, Leena",FROM SEEKERS TO ACTIVISTS,"Information, Communication & Society",12,5,August,658--677,2009,,,http://dx.doi.org/10.1080/13691180802345865,"Information, Communication & Society",,,,,Routledge,,,,,,,"Media culture is a firm part of youth cultures today. Media can also be seen as one empowering technology in the information society alongside traditional school and government. What kind of civic identities are young people constructing in contemporary media culture? This article discusses media-saturated youth and audience agency, drawing on Dahlgren's ideas of civic culture. Relying on empirical data from two case studies in Finland, we will introduce a typology of civic identities, which the young construct as members of the public in relation to media. Our first case study is a youth civic website called Vaikuttamo.net and the second is the Youth Voice Editorial Board, which consists of a group of young people producing news for mainstream media. Our research supports various earlier observations that young people are firmly engaged, though to a lesser extent, in the formal political realm. We particularly want to emphasize the role of the local media and the expressive potential of young people. The media should be noted as a public forum where cultural and political modes of expression and participation can be mixed ? not only in global online media, but also in more traditional local media such as television and newspaper. The research shows that young people are also willing to enter generational public discussions about civic issues instead of keeping to their own forums of media publicity. Media culture is a firm part of youth cultures today. Media can also be seen as one empowering technology in the information society alongside traditional school and government. What kind of civic identities are young people constructing in contemporary media culture? This article discusses media-saturated youth and audience agency, drawing on Dahlgren's ideas of civic culture. Relying on empirical data from two case studies in Finland, we will introduce a typology of civic identities, which the young construct as members of the public in relation to media. Our first case study is a youth civic website called Vaikuttamo.net and the second is the Youth Voice Editorial Board, which consists of a group of young people producing news for mainstream media. Our research supports various earlier observations that young people are firmly engaged, though to a lesser extent, in the formal political realm. We particularly want to emphasize the role of the local media and the expressive potential of young people. The media should be noted as a public forum where cultural and political modes of expression and participation can be mixed ? not only in global online media, but also in more traditional local media such as television and newspaper. The research shows that young people are also willing to enter generational public discussions about civic issues instead of keeping to their own forums of media publicity.",doi: 10.1080/13691180802345865,,,
7,,,"Ksiazek, Thomas B.; Peer, Limor & Zivic, Andrew",Discussing the News,Digital Journalism,3,6,November,850--870,2015,,,http://dx.doi.org/10.1080/21670811.2014.972079,Digital Journalism,,,,,Routledge,,,,,,,"The provision of online news provides unique opportunities for users to interact with content and with other users. One of the more common forms of interactivity involves commenting on news stories. These interactive features are often heralded for enabling virtual public discussion of current events. Yet there exists a widespread belief that these spaces fail to meet that lofty goal, instead exhibiting hostile and vitriolic discourse, which undermines the deliberative potential of online interaction. At the same time, there is a lack of consensus among researchers regarding the proper conceptualization of hostility, and its more desirable counterpart, civility. This article aims to integrate normative and contextual conceptual definitions of hostility and civility in online interactions with the news. Building on these, we develop operational definitions of the two concepts and analyze the presence of hostile and civil discussion in user comments posted to YouTube news videos. Further, we explore the possibility that the content and source of those news videos, as well as popularity and engagement metrics, may explain the degree of hostility and civility in comments. The provision of online news provides unique opportunities for users to interact with content and with other users. One of the more common forms of interactivity involves commenting on news stories. These interactive features are often heralded for enabling virtual public discussion of current events. Yet there exists a widespread belief that these spaces fail to meet that lofty goal, instead exhibiting hostile and vitriolic discourse, which undermines the deliberative potential of online interaction. At the same time, there is a lack of consensus among researchers regarding the proper conceptualization of hostility, and its more desirable counterpart, civility. This article aims to integrate normative and contextual conceptual definitions of hostility and civility in online interactions with the news. Building on these, we develop operational definitions of the two concepts and analyze the presence of hostile and civil discussion in user comments posted to YouTube news videos. Further, we explore the possibility that the content and source of those news videos, as well as popularity and engagement metrics, may explain the degree of hostility and civility in comments.",doi: 10.1080/21670811.2014.972079,,,
7,,,"Lenzner, Ben","The emergence of Occupy Wall Street and digital video practices: Tim Pool, live streaming and experimentations in citizen journalism",Studies in Documentary Film,8,3,September,251--266,2014,,,http://dx.doi.org/10.1080/17503280.2014.961634,Studies in Documentary Film,,,,,Routledge,,,,,,,"The relationship between digital video technologies, practitioners and the possibility spaces in which nascent digital video practices assemble relies on the dynamic engagement between technological possibilities and creative practices. This paper examines the relationship between practitioners, technology and technological infrastructure within documentary media practices that emerged in and around the Occupy Wall Street movement.In locales with well-connected infrastructure, the collaboration between hardware, software and global communications networks, often allows for makers of digital video to rapidly upload footage to real-time online platforms. Although quick uploading capacity appears to offer a relative ease of documentation, the immediacy of publication can be at once liberating and exceedingly complex in both the ethical and creative quandaries that may arise, for example, from the live streaming of political protests. How might relationships between live streaming and documentary methods of video production offer the practitioner and the audience a clearer sense of how documentary may or may not be evolving as a constantly changing, experimental and creative form of storytelling? This paper will examine the intricacies and ethics of these evolving relationships through an examination of the evolution of Tim Pool's live streaming practice that came to prominence during the Occupy Wall Street movement. The relationship between digital video technologies, practitioners and the possibility spaces in which nascent digital video practices assemble relies on the dynamic engagement between technological possibilities and creative practices. This paper examines the relationship between practitioners, technology and technological infrastructure within documentary media practices that emerged in and around the Occupy Wall Street movement.In locales with well-connected infrastructure, the collaboration between hardware, software and global communications networks, often allows for makers of digital video to rapidly upload footage to real-time online platforms. Although quick uploading capacity appears to offer a relative ease of documentation, the immediacy of publication can be at once liberating and exceedingly complex in both the ethical and creative quandaries that may arise, for example, from the live streaming of political protests. How might relationships between live streaming and documentary methods of video production offer the practitioner and the audience a clearer sense of how documentary may or may not be evolving as a constantly changing, experimental and creative form of storytelling? This paper will examine the intricacies and ethics of these evolving relationships through an examination of the evolution of Tim Pool's live streaming practice that came to prominence during the Occupy Wall Street movement.",doi: 10.1080/17503280.2014.961634,,,
7,,,"Levental, Simcha",A New Geospatial Services Framework: How Disaster Preparedness Efforts Should Integrate Neogeography,Journal of Map & Geography Libraries,8,2,May,134--162,2012,,,http://dx.doi.org/10.1080/15420353.2012.670084,Journal of Map & Geography Libraries,,,,,Routledge,,,,,,,"Geospatial technologies can be used in many intervention stages, from adaptation to disaster relief, and also in disaster response situations. These technological tools have been shown to have a transformative power on the quality and efficacy of response efforts. This paper focuses on the risk reduction phase. This phase is a continuous endeavor aimed at increasing resilience. For example, in the aftermath of the 2010 Haiti earthquake, groups of remotely stationed volunteers remapped Haiti using satellite imagery. Forces on the ground used this imagery to print maps using OpenStreetMap (OSM). Using cell-phone text messages, Short Message Service (SMS) response forces were able to locate and rescue citizens. The Ushahidi platform and OSM created a new paradigm for disaster response in which residents take the lead in operations. Unfortunately, this was able to happen only after the disaster hit. The following paper suggests a roadmap for the integration of crowd-sourcing tools and geospatial collaboration for the disaster preparedness phase. This multitiered proposal connects proper planning processes that engage the community, reduce risk, and ultimately provide for a more resilient community. The paper also aims to take the new disaster response paradigm and use it in the urban planning process. Rather than being a separate process, the disaster preparedness phase should enhance and strengthen communities, resulting in their becoming stronger and more resilient. Geospatial technologies can be used in many intervention stages, from adaptation to disaster relief, and also in disaster response situations. These technological tools have been shown to have a transformative power on the quality and efficacy of response efforts. This paper focuses on the risk reduction phase. This phase is a continuous endeavor aimed at increasing resilience. For example, in the aftermath of the 2010 Haiti earthquake, groups of remotely stationed volunteers remapped Haiti using satellite imagery. Forces on the ground used this imagery to print maps using OpenStreetMap (OSM). Using cell-phone text messages, Short Message Service (SMS) response forces were able to locate and rescue citizens. The Ushahidi platform and OSM created a new paradigm for disaster response in which residents take the lead in operations. Unfortunately, this was able to happen only after the disaster hit. The following paper suggests a roadmap for the integration of crowd-sourcing tools and geospatial collaboration for the disaster preparedness phase. This multitiered proposal connects proper planning processes that engage the community, reduce risk, and ultimately provide for a more resilient community. The paper also aims to take the new disaster response paradigm and use it in the urban planning process. Rather than being a separate process, the disaster preparedness phase should enhance and strengthen communities, resulting in their becoming stronger and more resilient.",doi: 10.1080/15420353.2012.670084,,,
7,,,"Lievrouw, Leah A.",Social Media and the Production of Knowledge: A Return to Little Science?,Social Epistemology,24,3,July,219--237,2010,,,http://dx.doi.org/10.1080/02691728.2010.499177,Social Epistemology,,,,,Routledge,,,,,,,"In the classic study Little science, big science (New York: Columbia University Press, 1963), Derek Price traces the historical shift from what he calls little science?exemplified by early?modern ?invisible colleges? of scientific amateurs and enthusiasts engaged in small?scale, informal interactions and personal correspondence?to 20th?century big science, dominated by professional scientists and wealthy institutions, where scientific information (primarily in print form and its analogues) was mass?produced, marketed and circulated on a global scale. This article considers whether the growing use of more participatory, interactive ?Web 2.0? technologies and social media in science today (e.g. wikis, blogs, tagging and bookmarking, conferencing, etc.) may signal a revival of little science modes of communication that contrast with big science conventions that continue to dominate research policy, scientific institutions, and the publishing industry. A brief historical review of responses to the scientific ?information explosion? since the early 1900s is presented, with a particular focus on the idealization of large?scale, automated information systems and the privileging of formal (document?producing) over informal (interpersonal) modes of scientific communication. Alternative frameworks for scientific communication that incorporate both documents and interaction are used to examine contemporary examples of so?called Science 2.0 and citizen science projects to determine whether such projects indicate the emergence of new modes of communication in science that bridge the immediacy and involvement of invisible colleges and the rigor of peer?reviewed publishing. The implications for traditional documentary forms such as the journal article are also discussed. In the classic study Little science, big science (New York: Columbia University Press, 1963), Derek Price traces the historical shift from what he calls little science?exemplified by early?modern ?invisible colleges? of scientific amateurs and enthusiasts engaged in small?scale, informal interactions and personal correspondence?to 20th?century big science, dominated by professional scientists and wealthy institutions, where scientific information (primarily in print form and its analogues) was mass?produced, marketed and circulated on a global scale. This article considers whether the growing use of more participatory, interactive ?Web 2.0? technologies and social media in science today (e.g. wikis, blogs, tagging and bookmarking, conferencing, etc.) may signal a revival of little science modes of communication that contrast with big science conventions that continue to dominate research policy, scientific institutions, and the publishing industry. A brief historical review of responses to the scientific ?information explosion? since the early 1900s is presented, with a particular focus on the idealization of large?scale, automated information systems and the privileging of formal (document?producing) over informal (interpersonal) modes of scientific communication. Alternative frameworks for scientific communication that incorporate both documents and interaction are used to examine contemporary examples of so?called Science 2.0 and citizen science projects to determine whether such projects indicate the emergence of new modes of communication in science that bridge the immediacy and involvement of invisible colleges and the rigor of peer?reviewed publishing. The implications for traditional documentary forms such as the journal article are also discussed.",doi: 10.1080/02691728.2010.499177,,,
7,,,"Marchionni, Doreen",CONVERSATIONAL JOURNALISM IN PRACTICE,Digital Journalism,1,2,June,252--269,2013,,,http://dx.doi.org/10.1080/21670811.2012.748513,Digital Journalism,,,,,Routledge,,,,,,,"This case study builds on recent experimental research that sought to measure journalism-as-a-conversation, or co-created news between citizens and journalists, by overlaying it on The Seattle Times? 2010 Pulitzer Prize-winning coverage of the slayings of four sheriff?s deputies. Pulitzer jurors singled out that coverage for its smart use of Web tools to enhance audience engagement and the paper?s overall online presence without sacrificing accuracy. Findings suggest the growing power of such tools in breaking news and beyond, but also the need for less common but perhaps more humanizing efforts, including short, personalized videos of journalists stepping from behind the veil of objectivity to discuss how they do what they do. This case study builds on recent experimental research that sought to measure journalism-as-a-conversation, or co-created news between citizens and journalists, by overlaying it on The Seattle Times? 2010 Pulitzer Prize-winning coverage of the slayings of four sheriff?s deputies. Pulitzer jurors singled out that coverage for its smart use of Web tools to enhance audience engagement and the paper?s overall online presence without sacrificing accuracy. Findings suggest the growing power of such tools in breaking news and beyond, but also the need for less common but perhaps more humanizing efforts, including short, personalized videos of journalists stepping from behind the veil of objectivity to discuss how they do what they do.",doi: 10.1080/21670811.2012.748513,,,
7,,,"Mohamed Haneef, M. Shuaib",Resistance to BT Brinjal in India: cyberactivism in Greenpeace website,Media Asia,42,1-2,April,74--82,2015,,,http://dx.doi.org/10.1080/01296612.2015.1072346,Media Asia,,,,,Routledge,,,,,,,"This paper captures the online discourse on BT Brinjal (Bacillus Thuringiensis Brinjal) in an online forum initiated by www.greenpeace.org in 2010 following the government?s decision to palm off the hybrid variety to farmers. In addition, the study provides insight into the ?tones? and ?perspectives? of the discussions surrounding BT Brinjal mostly in opposing the cultural shift from the organic to the genetically modified crop the government was attempting to impose on the social consciousness of the public and especially farmers. The study takes off from the Habermas public sphere theory applied to the interactive potential of the Internet. Deliberative and democratic social actions through the participation of citizens in the digital medium do not produce groups that arrive at a consensus. Instead, what is engendered are different publics, smaller, loosely connected, and engaging in ideology-based issues, producing polyvocal discourses. This paper captures the online discourse on BT Brinjal (Bacillus Thuringiensis Brinjal) in an online forum initiated by www.greenpeace.org in 2010 following the government?s decision to palm off the hybrid variety to farmers. In addition, the study provides insight into the ?tones? and ?perspectives? of the discussions surrounding BT Brinjal mostly in opposing the cultural shift from the organic to the genetically modified crop the government was attempting to impose on the social consciousness of the public and especially farmers. The study takes off from the Habermas public sphere theory applied to the interactive potential of the Internet. Deliberative and democratic social actions through the participation of citizens in the digital medium do not produce groups that arrive at a consensus. Instead, what is engendered are different publics, smaller, loosely connected, and engaging in ideology-based issues, producing polyvocal discourses.",doi: 10.1080/01296612.2015.1072346,,,
