BibliographyType,ISBN,Identifier,Author,Title,Journal,Volume,Number,Month,Pages,Year,Address,Note,URL,Booktitle,Chapter,Edition,Series,Editor,Publisher,ReportType,Howpublished,Institution,Organizations,School,Annote,Abstract,Custom2,Custom3,Custom4,Custom5
7,,,"Roy, Manoj; Curry, Robin & Ellis, Geraint","Spatial allocation of material flow analysis in residential developments: a case study of Kildare County, Ireland",Journal of Environmental Planning and Management,58,10,October,1749--1769,2015,,,http://dx.doi.org/10.1080/09640568.2014.951115,Journal of Environmental Planning and Management,,,,,Routledge,,,,,,,"Studies of urban metabolism provide important insights for environmental management of cities, but are not widely used in planning practice due to a mismatch of data scale and coverage. This paper introduces the Spatial Allocation of Material Flow Analysis (SAMFA) model as a potential decision support tool aimed as a contribution to overcome some of these difficulties and describes its pilot use at the county level in the Republic of Ireland. The results suggest that SAMFA is capable of identifying hotspots of higher material and energy use to support targeted planning initiatives, while its ability to visualise different policy scenarios supports more effective multi-stakeholder engagement. The paper evaluates this pilot use and sets out how this model can act as an analytical platform for the industrial ecology?spatial planning nexus. Studies of urban metabolism provide important insights for environmental management of cities, but are not widely used in planning practice due to a mismatch of data scale and coverage. This paper introduces the Spatial Allocation of Material Flow Analysis (SAMFA) model as a potential decision support tool aimed as a contribution to overcome some of these difficulties and describes its pilot use at the county level in the Republic of Ireland. The results suggest that SAMFA is capable of identifying hotspots of higher material and energy use to support targeted planning initiatives, while its ability to visualise different policy scenarios supports more effective multi-stakeholder engagement. The paper evaluates this pilot use and sets out how this model can act as an analytical platform for the industrial ecology?spatial planning nexus.",doi: 10.1080/09640568.2014.951115,,,
7,,,"Schultz, Lisa; Guevara, José Roberto; Ratnam, Samantha; Wierenga, Ani; Wyn, Johanna & Sowerby, Charlotte",Global Connections: ‘A Tool for Active Citizenship’,Development in Practice,19,8,November,1023--1034,2009,,,http://dx.doi.org/10.1080/09614520903220776,Development in Practice,,,,,Routledge,,,,,,,"As a result of globalisation and changing technologies, young people are increasingly required to engage with the broader world beyond their local and national communities. This raises significant questions about the ways and spaces in which young people will need to engage as active citizens, and the new tools and resources that young people will need to equip them for their futures. The Global Connections Program has been developed to address these identified needs. It is a youth-led global learning initiative which aims to provide an opportunity for connection and learning among young people in Australia and Indonesia. This article explores Plan's youth-led approach to global learning, with a focus on the implementation and evaluation findings of the Global Connections Program, as well as the challenges faced thus far. As a result of globalisation and changing technologies, young people are increasingly required to engage with the broader world beyond their local and national communities. This raises significant questions about the ways and spaces in which young people will need to engage as active citizens, and the new tools and resources that young people will need to equip them for their futures. The Global Connections Program has been developed to address these identified needs. It is a youth-led global learning initiative which aims to provide an opportunity for connection and learning among young people in Australia and Indonesia. This article explores Plan's youth-led approach to global learning, with a focus on the implementation and evaluation findings of the Global Connections Program, as well as the challenges faced thus far.",doi: 10.1080/09614520903220776,,,
7,,,"Scully, Patrick L. & Diebel, Alice",The essential and inherent democratic capacities of communities,Community Development,46,3,May,212--226,2015,,,http://dx.doi.org/10.1080/15575330.2015.1021363,Community Development,,,,,Routledge,,,,,,,"Despite the rise of many new forms of public participation, citizens often find themselves on the sidelines of civic initiatives. Observing that nascent democratic capacities are an under-used resource for community development, this article explores how widely applied understandings of capacity building fail to recognize the democratic capacities of communities. By exploring notions of capacity that span the fields of community development and civic engagement, this discussion argues that both fields can improve their ability to address complex public problems by paying close attention to the inherent democratic capacities of a community?s citizens, organizations, and networks. It suggests a framework for recognizing and analyzing these democratic capacities. An overlapping ?democratic practices? framework is presented as a way to analyze how communities apply their democratic capacities. The article concludes with case studies from Cooperative Extension that illustrate how citizen-centered community development and civic engagement grounded in public deliberation and dialog can build on and strengthen the democratic capacities of communities. Despite the rise of many new forms of public participation, citizens often find themselves on the sidelines of civic initiatives. Observing that nascent democratic capacities are an under-used resource for community development, this article explores how widely applied understandings of capacity building fail to recognize the democratic capacities of communities. By exploring notions of capacity that span the fields of community development and civic engagement, this discussion argues that both fields can improve their ability to address complex public problems by paying close attention to the inherent democratic capacities of a community?s citizens, organizations, and networks. It suggests a framework for recognizing and analyzing these democratic capacities. An overlapping ?democratic practices? framework is presented as a way to analyze how communities apply their democratic capacities. The article concludes with case studies from Cooperative Extension that illustrate how citizen-centered community development and civic engagement grounded in public deliberation and dialog can build on and strengthen the democratic capacities of communities.",doi: 10.1080/15575330.2015.1021363,,,
7,,,"Seol, Dong-Hoon",The citizenship of foreign workers in South Korea,Citizenship Studies,16,1,February,119--133,2012,,,http://dx.doi.org/10.1080/13621025.2012.651408,Citizenship Studies,,,,,Routledge,,,,,,,"The inflow of migrant workers poses many challenges to an ethnically homogenous Korean society. They have different features with regard to citizenship. In this article, I analyze the citizenship of migrant workers in Korea from three dimensions ? immigration policies, access to long-term and permanent residency and national citizenship, and the rights of migrant workers. First, I analyze requirements for employment and residency as stipulated in the Departures and Arrivals Control Act and the problems of differential application to target groups. Second, I discuss regulations in the Departures and Arrivals Control Act and the Nationality Act concerning the length of stay and requirements and process of applying for long-term and permanent residency, or Korean nationality. Third, I go over the basic rights of migrant workers: (1) civil rights; (2) social rights such as the rights to engage in work, the three primary rights of labor, social welfare rights, and the right to education of children of migrant workers; and (3) political rights including residents' rights for local autonomy. I closely analyze the difference in citizenship according to visa status and try to pinpoint key social problems of today. I also reflect on the desirable direction of Korea's immigration policies. The inflow of migrant workers poses many challenges to an ethnically homogenous Korean society. They have different features with regard to citizenship. In this article, I analyze the citizenship of migrant workers in Korea from three dimensions ? immigration policies, access to long-term and permanent residency and national citizenship, and the rights of migrant workers. First, I analyze requirements for employment and residency as stipulated in the Departures and Arrivals Control Act and the problems of differential application to target groups. Second, I discuss regulations in the Departures and Arrivals Control Act and the Nationality Act concerning the length of stay and requirements and process of applying for long-term and permanent residency, or Korean nationality. Third, I go over the basic rights of migrant workers: (1) civil rights; (2) social rights such as the rights to engage in work, the three primary rights of labor, social welfare rights, and the right to education of children of migrant workers; and (3) political rights including residents' rights for local autonomy. I closely analyze the difference in citizenship according to visa status and try to pinpoint key social problems of today. I also reflect on the desirable direction of Korea's immigration policies.",doi: 10.1080/13621025.2012.651408,,,
7,,,"Sextos, Anastasios G.",A paperless course on structural engineering programming: investing in educational technology in the times of the Greek financial recession,European Journal of Engineering Education,39,1,January,18--30,2014,,,http://dx.doi.org/10.1080/03043797.2013.824413,European Journal of Engineering Education,,,,,Taylor & Francis,,,,,,,"This paper presents the structure of an undergraduate course entitled ?programming techniques and the use of specialised software in structural engineering? which is offered to the fifth (final) year students of the Civil Engineering Department of Aristotle University Thessaloniki in Greece. The aim of this course is to demonstrate the use of new information technologies in the field of structural engineering and to teach modern programming and finite element simulation techniques that the students can in turn apply in both research and everyday design of structures. The course also focuses on the physical interpretation of structural engineering problems, in a way that the students become familiar with the concept of computational tools without losing perspective from the engineering problem studied. For this purpose, a wide variety of structural engineering problems are studied in class, involving structural statics, dynamics, earthquake engineering, design of reinforced concrete and steel structures as well as data and information management. The main novelty of the course is that it is taught and examined solely in the computer laboratory ensuring that each student can accomplish the prescribed ?hands-on? training on a dedicated computer, strictly on a 1:1 student over hardware ratio. Significant effort has also been put so that modern educational techniques and tools are utilised to offer the course in an essentially paperless mode. This involves electronic educational material, video tutorials, student information in real time and exams given and assessed electronically through an ad hoc developed, personalised, electronic system. The positive feedback received from the students reveals that the concept of a paperless course is not only applicable in real academic conditions but is also a promising approach that significantly increases student productivity and engagement. The question, however, is whether such an investment in educational technology is indeed timely during economic recession, where the academic priorities are rapidly changing. In the light of this unfavourable and unstable financial environment, a critical overview of the strengths, the weaknesses, the opportunities and the threats of this effort is presented herein, hopefully contributing to the discussion on the future of higher education in the time of crisis. This paper presents the structure of an undergraduate course entitled ?programming techniques and the use of specialised software in structural engineering? which is offered to the fifth (final) year students of the Civil Engineering Department of Aristotle University Thessaloniki in Greece. The aim of this course is to demonstrate the use of new information technologies in the field of structural engineering and to teach modern programming and finite element simulation techniques that the students can in turn apply in both research and everyday design of structures. The course also focuses on the physical interpretation of structural engineering problems, in a way that the students become familiar with the concept of computational tools without losing perspective from the engineering problem studied. For this purpose, a wide variety of structural engineering problems are studied in class, involving structural statics, dynamics, earthquake engineering, design of reinforced concrete and steel structures as well as data and information management. The main novelty of the course is that it is taught and examined solely in the computer laboratory ensuring that each student can accomplish the prescribed ?hands-on? training on a dedicated computer, strictly on a 1:1 student over hardware ratio. Significant effort has also been put so that modern educational techniques and tools are utilised to offer the course in an essentially paperless mode. This involves electronic educational material, video tutorials, student information in real time and exams given and assessed electronically through an ad hoc developed, personalised, electronic system. The positive feedback received from the students reveals that the concept of a paperless course is not only applicable in real academic conditions but is also a promising approach that significantly increases student productivity and engagement. The question, however, is whether such an investment in educational technology is indeed timely during economic recession, where the academic priorities are rapidly changing. In the light of this unfavourable and unstable financial environment, a critical overview of the strengths, the weaknesses, the opportunities and the threats of this effort is presented herein, hopefully contributing to the discussion on the future of higher education in the time of crisis.",doi: 10.1080/03043797.2013.824413,,,
7,,,"Shafer, Richard & Aregood, Richard",Protecting Journalists by Applying the Civic Journalism Model in Developing Countries: A Case Study of the Philippines,Media Asia,39,2,January,93--98,2012,,,http://dx.doi.org/10.1080/01296612.2012.11689923,Media Asia,,,,,Routledge,,,,,,,"Civic journalism, the community-inclusive cooperative model that has faded in the United States, where it had first blossomed, has the potential to be re-purposed to provide security for journalists in areas where it can be dangerous to practise the traditional Western-objective model. The Philippines, where journalists in recent years have been killed at the highest rate in the world, provides an illustrative case study for this concept because of its Westernised, vigorous press and the violent insurgencies that have continued in some provincial areas. Recent experiments with civic journalism in the Philippines under corporate sponsorship suggest how adaptations of the model might help organise effective news reporting, supported by local citizens, to inform safer and more effective press practices in regions such as the island of Mindanao where journalists have been particularly endangered. Our discussion of experiments with civic journalism suggests that it might be more widely applied to organising popular support for journalists engaged in reporting on difficult topics that are important to resolving conflict and furthering development in underdeveloped and unstable regions. Civic journalism, the community-inclusive cooperative model that has faded in the United States, where it had first blossomed, has the potential to be re-purposed to provide security for journalists in areas where it can be dangerous to practise the traditional Western-objective model. The Philippines, where journalists in recent years have been killed at the highest rate in the world, provides an illustrative case study for this concept because of its Westernised, vigorous press and the violent insurgencies that have continued in some provincial areas. Recent experiments with civic journalism in the Philippines under corporate sponsorship suggest how adaptations of the model might help organise effective news reporting, supported by local citizens, to inform safer and more effective press practices in regions such as the island of Mindanao where journalists have been particularly endangered. Our discussion of experiments with civic journalism suggests that it might be more widely applied to organising popular support for journalists engaged in reporting on difficult topics that are important to resolving conflict and furthering development in underdeveloped and unstable regions.",doi: 10.1080/01296612.2012.11689923,,,
7,,,"Shumer, Robert; Lam, Carolina & Laabs, Bonnie",Ensuring good character and civic education: connecting through service learning,Asia Pacific Journal of Education,32,4,December,430--440,2012,,,http://dx.doi.org/10.1080/02188791.2012.741768,Asia Pacific Journal of Education,,,,,Routledge,,,,,,,"Character and citizenship education are part of the vision of many countries, including Singapore. Ensuring they are implemented in academic environments, service learning has been shown to be a natural bridge between the two. Research has shown that service learning, when done well, produces outcomes related to character development and citizenship education. As a modern educational movement, its early founders described it as a pedagogy to engage individuals in service activities dictated by the community, whereby the learning applies academic subject matter to the service. It is also a philosophy where the service is developed in collaboration with the community, where the goal is empowering those most affected by social and economic challenges. It is often delivered through academic course connections, but is effectively developed through constructivist approaches to curriculum, where the community prescribed needs define the subjects required for study and service. Service learning and character education are mutually connected constructs where service learning becomes the vehicle for delivery of character development. Individuals learn good character by applying those character traits in social settings through service. Good learning is assured when the nature of the service and character are intertwined, and the knowledge and skills gained connect directly to the actions of the people involved. Character and citizenship education are part of the vision of many countries, including Singapore. Ensuring they are implemented in academic environments, service learning has been shown to be a natural bridge between the two. Research has shown that service learning, when done well, produces outcomes related to character development and citizenship education. As a modern educational movement, its early founders described it as a pedagogy to engage individuals in service activities dictated by the community, whereby the learning applies academic subject matter to the service. It is also a philosophy where the service is developed in collaboration with the community, where the goal is empowering those most affected by social and economic challenges. It is often delivered through academic course connections, but is effectively developed through constructivist approaches to curriculum, where the community prescribed needs define the subjects required for study and service. Service learning and character education are mutually connected constructs where service learning becomes the vehicle for delivery of character development. Individuals learn good character by applying those character traits in social settings through service. Good learning is assured when the nature of the service and character are intertwined, and the knowledge and skills gained connect directly to the actions of the people involved.",doi: 10.1080/02188791.2012.741768,,,
7,,,"Thambiratnam, D P & Perera, N J",Protection of Structural Systems and Mechanisms from Catastrophic and Life-Threatening Failure Caused by Unforeseeable Events,Australian Journal of Structural Engineering,13,1,January,81--96,2012,,,http://www.tandfonline.com/doi/abs/10.7158/13287982.2012.11465101,Australian Journal of Structural Engineering,,,,,Taylor & Francis,,,,,,,"AbstractStructural framing systems and mechanisms designed for normal use rarely possess adequate robustness to withstand the effects of large impacts, blasts and extreme earthquakes that have been experienced in recent times. Robustness is the property of systems that enables them to survive unforeseen or unusual circumstances (Knoll & Vogel, 2009). Queensland University of Technology with industry collaboration is engaged in a program of research that commenced 15 years ago to study the impact of such unforeseeable phenomena and investigate methods of improving robustness and safety with protective mechanisms embedded or designed in structural systems. This paper highlights some of the research pertaining to seismic protection of building structures, rollover protective structures and effects of vehicular impact and blast on key elements in structures that could propagate catastrophic and disproportionate collapse. AbstractStructural framing systems and mechanisms designed for normal use rarely possess adequate robustness to withstand the effects of large impacts, blasts and extreme earthquakes that have been experienced in recent times. Robustness is the property of systems that enables them to survive unforeseen or unusual circumstances (Knoll & Vogel, 2009). Queensland University of Technology with industry collaboration is engaged in a program of research that commenced 15 years ago to study the impact of such unforeseeable phenomena and investigate methods of improving robustness and safety with protective mechanisms embedded or designed in structural systems. This paper highlights some of the research pertaining to seismic protection of building structures, rollover protective structures and effects of vehicular impact and blast on key elements in structures that could propagate catastrophic and disproportionate collapse.",doi: 10.7158/13287982.2012.11465101,,,
