BibliographyType,ISBN,Identifier,Author,Title,Journal,Volume,Number,Month,Pages,Year,Address,Note,URL,Booktitle,Chapter,Edition,Series,Editor,Publisher,ReportType,Howpublished,Institution,Organizations,School,Annote,Abstract,Custom2,Custom3,Custom4,Custom5
7,,,"Delicado, Ana",Environmental education technologies in a social void: the case of ‘Greendrive’,Environmental Education Research,18,6,December,831--843,2012,,,http://dx.doi.org/10.1080/13504622.2012.683849,Environmental Education Research,,,,,Routledge,,,,,,,"This article is based on a case study that follows the trajectory of a technological device aimed at environmental education from the engineering laboratory in which it was designed into the contexts in which it is used. ?Greendrive? is a driving simulator that accurately reproduces the performance of a vehicle in terms of fuel consumption and greenhouse gases emissions, in order to instill the principles of safe and environmentally friendly driving. The text is divided into three parts. The first part introduces the issue of transport behavior as one of the causes of climate change and the role of eco-driving in reducing emissions. The second part describes how a team of Portuguese engineering researchers developed the driving simulator and how a local authority and a consulting and training company are using it. Finally, the discussion part aims to show that despite the intentions of its creators and their clients, the driving simulator is unlikely, by itself, to generate changes in behavior. An information-deficit approach to environmental education that fails to consider the social embeddedness of human action and disregards the engagement of citizens has a very limited chance of success. This article is based on a case study that follows the trajectory of a technological device aimed at environmental education from the engineering laboratory in which it was designed into the contexts in which it is used. ?Greendrive? is a driving simulator that accurately reproduces the performance of a vehicle in terms of fuel consumption and greenhouse gases emissions, in order to instill the principles of safe and environmentally friendly driving. The text is divided into three parts. The first part introduces the issue of transport behavior as one of the causes of climate change and the role of eco-driving in reducing emissions. The second part describes how a team of Portuguese engineering researchers developed the driving simulator and how a local authority and a consulting and training company are using it. Finally, the discussion part aims to show that despite the intentions of its creators and their clients, the driving simulator is unlikely, by itself, to generate changes in behavior. An information-deficit approach to environmental education that fails to consider the social embeddedness of human action and disregards the engagement of citizens has a very limited chance of success.",doi: 10.1080/13504622.2012.683849,,,
7,,,"Desportes, I.; Waddell, J. & Hordijk, M.","Improving flood risk governance through multi-stakeholder collaboration: a case study of Sweet Home informal settlement, Cape Town",South African Geographical Journal,98,1,January,61--83,2016,,,http://dx.doi.org/10.1080/03736245.2015.1052842,South African Geographical Journal,,,,,Routledge,,,,,,,"Bringing a wider range of stakeholders together has become increasingly important in disaster risk reduction discourse, particularly in informal settlements located on marginal, flood-prone land in many cities of the global South. Attempts by the City of Cape Town (CCT) municipality, civil society organizations (CSOs) and affected residents to cope with floods, which impact about 88,000 households on the low-lying Cape Flats, reflect the ongoing political, social and technical constraints inherent in areas of informality. Using the flood-prone informal settlement of Sweet Home as a case study, a participatory, qualitative methodology was adopted to question the extent to which the CCT, CSOs and Sweet Home residents currently collaborate to address flood risk. Although the CCT's Flood and Storms Task Team is recognized as an innovative, collaborative and pro-active approach for addressing city-wide flood risk, shortcomings still remain. Focusing not only on ?why collaboration is necessary?, but also on ?how? collaboration can be achieved in the highly politicized context of South African informal settlements, this research identifies some of the critical barriers faced by stakeholders in Cape Town to address flood risk collaboratively. It explores how these barriers can be overcome and highlights the role that academics can play in creating more politically neutral platforms for stakeholders to engage with each other. Bringing a wider range of stakeholders together has become increasingly important in disaster risk reduction discourse, particularly in informal settlements located on marginal, flood-prone land in many cities of the global South. Attempts by the City of Cape Town (CCT) municipality, civil society organizations (CSOs) and affected residents to cope with floods, which impact about 88,000 households on the low-lying Cape Flats, reflect the ongoing political, social and technical constraints inherent in areas of informality. Using the flood-prone informal settlement of Sweet Home as a case study, a participatory, qualitative methodology was adopted to question the extent to which the CCT, CSOs and Sweet Home residents currently collaborate to address flood risk. Although the CCT's Flood and Storms Task Team is recognized as an innovative, collaborative and pro-active approach for addressing city-wide flood risk, shortcomings still remain. Focusing not only on ?why collaboration is necessary?, but also on ?how? collaboration can be achieved in the highly politicized context of South African informal settlements, this research identifies some of the critical barriers faced by stakeholders in Cape Town to address flood risk collaboratively. It explores how these barriers can be overcome and highlights the role that academics can play in creating more politically neutral platforms for stakeholders to engage with each other.",doi: 10.1080/03736245.2015.1052842,,,
7,,,"Dorsman, Stephan J.; Bekkers, Victor J.J.M. & Edwards, Arthur R.",‘Trust the experts!’ Risk definitions in Dutch online forums about the ‘swine flu’,"Information, Communication & Society",18,10,October,1217--1237,2015,,,http://dx.doi.org/10.1080/1369118X.2015.1036767,"Information, Communication & Society",,,,,Routledge,,,,,,,"Citizens are becoming increasingly likely to challenge the knowledge bases underlying policy programmes that deal with risks. This paper investigates how participants in online discussions engage in interactions between expert knowledge, ?commons knowledge? and policy assumptions. The concept of ?boundary objects?, arrangements that allow different groups to work together without consensus, is used to analyse the role of online discussions in these interactions. Discussions on three Dutch online forums about the swine flu are investigated according to a framework for policy argumentation. Interaction between knowledge domains was limited, and it varied in focus and nature across the three forums. Each discussion functioned as a partial approximation of a boundary object. Government organizations should be more aware of the variety of online forums in which discussions about societal risks take place. Several practical options are presented for policy-making with regard to risks. Citizens are becoming increasingly likely to challenge the knowledge bases underlying policy programmes that deal with risks. This paper investigates how participants in online discussions engage in interactions between expert knowledge, ?commons knowledge? and policy assumptions. The concept of ?boundary objects?, arrangements that allow different groups to work together without consensus, is used to analyse the role of online discussions in these interactions. Discussions on three Dutch online forums about the swine flu are investigated according to a framework for policy argumentation. Interaction between knowledge domains was limited, and it varied in focus and nature across the three forums. Each discussion functioned as a partial approximation of a boundary object. Government organizations should be more aware of the variety of online forums in which discussions about societal risks take place. Several practical options are presented for policy-making with regard to risks.",doi: 10.1080/1369118X.2015.1036767,,,
7,,,"Emery, Jennifer Kelkres; Howard, Alison & Evans, Jocelyn","Teaching Better, Teaching Together: A Coordinated Student Exit Poll Across the States",Journal of Political Science Education,10,4,October,471--486,2014,,,http://dx.doi.org/10.1080/15512169.2014.947419,Journal of Political Science Education,,,,,Routledge,,,,,,,"Student exit polling has demonstrated value in the classroom (Berry and Robinson 2012; Evans and Lagergren 2007; Lelieveldt and Rossen 2009), but faculty typically operate these polls in isolation. When faculty collaborate, however, students gain additional benefits from the experience. Collaboration provides a geographically diverse ?student community? that allows students to engage in experiential learning beyond the confines of their immediate classrooms. The authors have created assignments and an instructor's manual on running student exit polls in undergraduate courses. Three institutions used these assignments during the Fall 2012 semester. By using structured assignments, these instructors created an opportunity to participate collaboratively with others in survey design and data analysis. Student assessment data showed that students explored their own political communities and honed skills across learning domains. Most importantly, students applied relevant political science concepts to the electoral process, exercised critical thinking, practiced oral and written communication, and grappled with project management. This type of collaboration provides political perspective and community engagement within political science for both faculty and students. Student exit polling has demonstrated value in the classroom (Berry and Robinson 2012; Evans and Lagergren 2007; Lelieveldt and Rossen 2009), but faculty typically operate these polls in isolation. When faculty collaborate, however, students gain additional benefits from the experience. Collaboration provides a geographically diverse ?student community? that allows students to engage in experiential learning beyond the confines of their immediate classrooms. The authors have created assignments and an instructor's manual on running student exit polls in undergraduate courses. Three institutions used these assignments during the Fall 2012 semester. By using structured assignments, these instructors created an opportunity to participate collaboratively with others in survey design and data analysis. Student assessment data showed that students explored their own political communities and honed skills across learning domains. Most importantly, students applied relevant political science concepts to the electoral process, exercised critical thinking, practiced oral and written communication, and grappled with project management. This type of collaboration provides political perspective and community engagement within political science for both faculty and students.",doi: 10.1080/15512169.2014.947419,,,
7,,,"Flynn, Rob; Ricci, Miriam & Bellaby, Paul",The Mirage of Citizen Engagement in Uncertain Science: Public attitudes towards hydrogen energy,"International Journal of Science Education, Part B",1,2,September,97--114,2011,,,http://dx.doi.org/10.1080/21548455.2011.585810,"International Journal of Science Education, Part B",,,,,Routledge,,,,,,,"This paper addresses some of the debates about citizen involvement in decisions about science and technological innovation. It describes some of the claims and scientific uncertainties surrounding hydrogen energy. It examines qualitative evidence from a series of recent case studies in the UK about public perceptions of hydrogen. It is shown that public attitudes towards citizen engagement are highly ambivalent. While citizens approve of greater consultation, they raise doubts about the degree to which laypersons can be mobilised to participate in public debates, they express contradictory views about their trust in experts, and they are sceptical about whether such involvement will influence policy. These findings add further questions about the efficacy of upstream public engagement in assessments of emergent or novel technologies. They also suggest that over-optimistic expectations about upstream engagement may have to be moderated. This paper addresses some of the debates about citizen involvement in decisions about science and technological innovation. It describes some of the claims and scientific uncertainties surrounding hydrogen energy. It examines qualitative evidence from a series of recent case studies in the UK about public perceptions of hydrogen. It is shown that public attitudes towards citizen engagement are highly ambivalent. While citizens approve of greater consultation, they raise doubts about the degree to which laypersons can be mobilised to participate in public debates, they express contradictory views about their trust in experts, and they are sceptical about whether such involvement will influence policy. These findings add further questions about the efficacy of upstream public engagement in assessments of emergent or novel technologies. They also suggest that over-optimistic expectations about upstream engagement may have to be moderated.",doi: 10.1080/21548455.2011.585810,,,
7,,,"Francoli, Mary",The digital MP or how I learned to stop worrying and love MP,Journal of Media Practice,10,2-3,January,215--225,2009,,,http://www.tandfonline.com/doi/abs/10.1386/jmpr.10.2-3.215_1,Journal of Media Practice,,,,,Routledge,,,,,,,"AbstractIt is hard to imagine life on Parliament Hill in Canada without the ubiquitous Blackberry. The device has become so common place that we no longer bat an eye when we hear its rhythmic buzzing or find its frenzied operators tapping away on its minuscule keyboard. It's just one of new technologies that have caught the attention of the modern ?digital? MP. Today, almost every MP has a website and we've seen increasing interest in experimentation with blogs, online consultations, e-petitions and various social networking sites. They have brought myriad changes and challenges to the functions of MPs and their relationships with constituents. This paper details how various information and communication technologies, or ICTs, are being used by MPs in Canada. It questions whether they are being used to enhance citizen engagement, for professionalization, or both. Ultimately, it is concluded that there are more opportunities for consultation, but few, such as Canadian MP Garth Turner, are embracing the potential for greater participation. AbstractIt is hard to imagine life on Parliament Hill in Canada without the ubiquitous Blackberry. The device has become so common place that we no longer bat an eye when we hear its rhythmic buzzing or find its frenzied operators tapping away on its minuscule keyboard. It's just one of new technologies that have caught the attention of the modern ?digital? MP. Today, almost every MP has a website and we've seen increasing interest in experimentation with blogs, online consultations, e-petitions and various social networking sites. They have brought myriad changes and challenges to the functions of MPs and their relationships with constituents. This paper details how various information and communication technologies, or ICTs, are being used by MPs in Canada. It questions whether they are being used to enhance citizen engagement, for professionalization, or both. Ultimately, it is concluded that there are more opportunities for consultation, but few, such as Canadian MP Garth Turner, are embracing the potential for greater participation.",doi: 10.1386/jmpr.10.2-3.215_1,,,
7,,,"Gaines, Brian J. & Mondak, Jeffery J.",Typing Together? Clustering of Ideological Types in Online Social Networks,Journal of Information Technology & Politics,6,3-4,July,216--231,2009,,,http://dx.doi.org/10.1080/19331680903031531,Journal of Information Technology & Politics,,,,,Routledge,,,,,,,"ABSTRACT In the brief span of only a few years, the Facebook social networking site has emerged as a central forum for social interaction and communication. The fact that Facebook members may well be rich in ?virtual social capital? could be important news from the standpoint of political engagement and mobilization, and, more broadly, in terms of the content and patterns of social interaction. In this article, we discuss the significance of the Facebook phenomenon for scholarship on social networks. A brief introduction to Facebook is presented, along with an assessment of the benefits and limitations inherent in research regarding Facebook networks. We then report some preliminary analyses of small samples from those networks. Drawing on past research regarding face-to-face social relationships, we examine whether online linkages possess some of the central characteristics common in more traditional forms of networks. Specifically, we focus on whether there are signs of clustering by Facebook members according to their political views, and whether the effects of tie strength observed in other forms of networks also are in evidence on Facebook. ABSTRACT In the brief span of only a few years, the Facebook social networking site has emerged as a central forum for social interaction and communication. The fact that Facebook members may well be rich in ?virtual social capital? could be important news from the standpoint of political engagement and mobilization, and, more broadly, in terms of the content and patterns of social interaction. In this article, we discuss the significance of the Facebook phenomenon for scholarship on social networks. A brief introduction to Facebook is presented, along with an assessment of the benefits and limitations inherent in research regarding Facebook networks. We then report some preliminary analyses of small samples from those networks. Drawing on past research regarding face-to-face social relationships, we examine whether online linkages possess some of the central characteristics common in more traditional forms of networks. Specifically, we focus on whether there are signs of clustering by Facebook members according to their political views, and whether the effects of tie strength observed in other forms of networks also are in evidence on Facebook.",doi: 10.1080/19331680903031531,,,
7,,,"Graham, Todd; Jackson, Daniel & Wright, Scott",‘We need to get together and make ourselves heard’: everyday online spaces as incubators of political action,"Information, Communication & Society",,,October,1--17,2015,,,http://dx.doi.org/10.1080/1369118X.2015.1094113,"Information, Communication & Society",,,,,Routledge,,,,,,,"ABSTRACTThis article examines to what extent, and how, people engaging in political talk within ?non-political? discussion forums ? online lifestyle communities ? leads to political (or personal) action or calls-to-action. The analysis is framed in the context of wider questions of citizenship, civic engagement and political mobilization. To capture everyday political talk amongst citizens requires us to move beyond the now widely analysed online spaces of formal politics. Instead, we focus on online third spaces concerning lifestyle issues such as parenting, personal finance and popular culture. Drawing on a content analysis of three popular UK-based discussion forums over the course of five years (2010?2014), we found that (for two of the three cases) such spaces were more than just talking shops. Rather they were spaces where political actions not only emerged, but where they seemed to be cultivated. Discussions embedded in the personal lives of participants often developed ? through talk ? into political actions aimed at government (or other) authorities. The article sheds light on the contributing factors and processes that (potentially) trigger and foster action emerging from political talk and provides insight into the mobilization potential of third spaces. ABSTRACTThis article examines to what extent, and how, people engaging in political talk within ?non-political? discussion forums ? online lifestyle communities ? leads to political (or personal) action or calls-to-action. The analysis is framed in the context of wider questions of citizenship, civic engagement and political mobilization. To capture everyday political talk amongst citizens requires us to move beyond the now widely analysed online spaces of formal politics. Instead, we focus on online third spaces concerning lifestyle issues such as parenting, personal finance and popular culture. Drawing on a content analysis of three popular UK-based discussion forums over the course of five years (2010?2014), we found that (for two of the three cases) such spaces were more than just talking shops. Rather they were spaces where political actions not only emerged, but where they seemed to be cultivated. Discussions embedded in the personal lives of participants often developed ? through talk ? into political actions aimed at government (or other) authorities. The article sheds light on the contributing factors and processes that (potentially) trigger and foster action emerging from political talk and provides insight into the mobilization potential of third spaces.",doi: 10.1080/1369118X.2015.1094113,,,
7,,,"Hall, G. Brent; Chipeniuk, Raymond; Feick, Robert D.; Leahy, Michael G. & Deparday, Vivien",Community-based production of geographic information using open source software and Web 2.0,International Journal of Geographical Information Science,24,5,April,761--781,2010,,,http://dx.doi.org/10.1080/13658810903213288,International Journal of Geographical Information Science,,,,,Taylor & Francis,,,,,,,"This article presents an innovative approach to citizen-led production of Web-based geographic information where new and/or existing digital map features are linked to annotations or commentary and citizens engage in synchronous and/or asynchronous discussion. The article discusses the relationship of the approach to public participation geographic information systems (PPGISs) and the emerging challenges associated with volunteered geographic information. A custom-developed, open source software tool named MapChat is used to facilitate the citizen inputs and discussions. The information generated from applying the approach through a series of community workshops is presented and discussed in light of current issues in PPGIS and volunteered geographic information research. This article presents an innovative approach to citizen-led production of Web-based geographic information where new and/or existing digital map features are linked to annotations or commentary and citizens engage in synchronous and/or asynchronous discussion. The article discusses the relationship of the approach to public participation geographic information systems (PPGISs) and the emerging challenges associated with volunteered geographic information. A custom-developed, open source software tool named MapChat is used to facilitate the citizen inputs and discussions. The information generated from applying the approach through a series of community workshops is presented and discussed in light of current issues in PPGIS and volunteered geographic information research.",doi: 10.1080/13658810903213288,,,
