BibliographyType,ISBN,Identifier,Author,Title,Journal,Volume,Number,Month,Pages,Year,Address,Note,URL,Booktitle,Chapter,Edition,Series,Editor,Publisher,ReportType,Howpublished,Institution,Organizations,School,Annote,Abstract,Custom2,Custom3,Custom4,Custom5
7,,,"Connors, John Patrick; Lei, Shufei & Kelly, Maggi",Citizen Science in the Age of Neogeography: Utilizing Volunteered Geographic Information for Environmental Monitoring,Annals of the Association of American Geographers,102,6,November,1267--1289,2012,,,http://dx.doi.org/10.1080/00045608.2011.627058,Annals of the Association of American Geographers,,,,,Routledge,,,,,,,"The interface between neogeography and citizen science has great potential for environmental monitoring, but this nexus has been explored less often than each subject individually. In this article we review the emerging role of volunteered geographic information in citizen science and present a case study of an integrated tool set that engages multiple types of users (from targeted citizen-based observation networks, expert-driven focused monitoring, and opportunistic crowdsourcing efforts) in monitoring a forest disease in the western United States. We first introduce the overall challenge of data collection in environmental monitoring projects and then discuss the literature surrounding an emergent integration of citizen science and volunteered geographical information. We next explore how these methods characterize and underpin knowledge discovery and how multimodal interaction is supported so that a large spectrum of contributors can be included. These concepts are summarized in a conceptual model that articulates the important gradients of Web-based environmental monitoring: the users, the interaction between users and data, and the types of information generated. Using this model, we critically examine OakMapper.org, a Web site created by the authors to collect and distribute spatial information related to the spread of a forest disease, and discuss many of the core issues and new challenges presented by the intersection of citizen science and volunteered geographic information in the context of environmental monitoring. We argue that environmental monitoring can benefit from this synergy: The increased emphasis on a diversity of participants in knowledge production might help to reduce the gaps that have in the past divided the public, researchers, and policymakers in such efforts. The interface between neogeography and citizen science has great potential for environmental monitoring, but this nexus has been explored less often than each subject individually. In this article we review the emerging role of volunteered geographic information in citizen science and present a case study of an integrated tool set that engages multiple types of users (from targeted citizen-based observation networks, expert-driven focused monitoring, and opportunistic crowdsourcing efforts) in monitoring a forest disease in the western United States. We first introduce the overall challenge of data collection in environmental monitoring projects and then discuss the literature surrounding an emergent integration of citizen science and volunteered geographical information. We next explore how these methods characterize and underpin knowledge discovery and how multimodal interaction is supported so that a large spectrum of contributors can be included. These concepts are summarized in a conceptual model that articulates the important gradients of Web-based environmental monitoring: the users, the interaction between users and data, and the types of information generated. Using this model, we critically examine OakMapper.org, a Web site created by the authors to collect and distribute spatial information related to the spread of a forest disease, and discuss many of the core issues and new challenges presented by the intersection of citizen science and volunteered geographic information in the context of environmental monitoring. We argue that environmental monitoring can benefit from this synergy: The increased emphasis on a diversity of participants in knowledge production might help to reduce the gaps that have in the past divided the public, researchers, and policymakers in such efforts.",doi: 10.1080/00045608.2011.627058,,,
7,,,"Davies, Sarah R. & Selin, Cynthia",Energy Futures: Five Dilemmas of the Practice of Anticipatory Governance,Environmental Communication,6,1,March,119--136,2012,,,http://dx.doi.org/10.1080/17524032.2011.644632,Environmental Communication,,,,,Routledge,,,,,,,"Public participation has become standard practice in both environmental communication and science and technology studies, with such engagement increasingly moving ?upstream? to the early stages of technological development. One framework for these activities is anticipatory governance, in which foresight and public and stakeholder engagement are used to reflect on?and direct?the impacts of new technology. In this essay we draw on our experience of anticipatory governance, in the shape of the ?NanoFutures? project on energy futures, to present a reflexive analysis of engagement and deliberation. We draw out five tensions of the practice of deliberation on energy technologies. Through tracing the lineages of these dilemmas, we discuss some of the implications of these tensions for the practice of civic engagement and deliberation in a set of questions for this community of practitioner-scholars. Public participation has become standard practice in both environmental communication and science and technology studies, with such engagement increasingly moving ?upstream? to the early stages of technological development. One framework for these activities is anticipatory governance, in which foresight and public and stakeholder engagement are used to reflect on?and direct?the impacts of new technology. In this essay we draw on our experience of anticipatory governance, in the shape of the ?NanoFutures? project on energy futures, to present a reflexive analysis of engagement and deliberation. We draw out five tensions of the practice of deliberation on energy technologies. Through tracing the lineages of these dilemmas, we discuss some of the implications of these tensions for the practice of civic engagement and deliberation in a set of questions for this community of practitioner-scholars.",doi: 10.1080/17524032.2011.644632,,,
7,,,"Desouza, Kevin C. & Bhagwatwar, Akshay",Citizen Apps to Solve Complex Urban Problems,Journal of Urban Technology,19,3,July,107--136,2012,,,http://dx.doi.org/10.1080/10630732.2012.673056,Journal of Urban Technology,,,,,Routledge,,,,,,,"Tackling complex urban problems requires us to examine and leverage diverse sources of information. Today, cities capture large amounts of information in real-time. Data are captured on transportation patterns, electricity and water consumption, citizen use of government services (e.g., parking meters), and even on weather events. Through open data initiatives, government agencies are making information available to citizens. In turn, citizens are building applications that exploit this information to solve local urban problems. Citizens are also building platforms where they can share information regarding government services. Information that was previously unavailable is now being used to gauge quality of services, choose services, and report illegal and unethical behaviors (e.g., requesting bribes). To the best of our knowledge, this is the first paper to examine the range of citizen applications (?citizen apps?) targeting urban issues and to address their effects on urban planning, decision-making, problem solving, and governance. We examine citizen apps that address a wide range of urban issues from those that solve public transportation challenges to those that improve the management of public utilities and services and even public safety. Tackling complex urban problems requires us to examine and leverage diverse sources of information. Today, cities capture large amounts of information in real-time. Data are captured on transportation patterns, electricity and water consumption, citizen use of government services (e.g., parking meters), and even on weather events. Through open data initiatives, government agencies are making information available to citizens. In turn, citizens are building applications that exploit this information to solve local urban problems. Citizens are also building platforms where they can share information regarding government services. Information that was previously unavailable is now being used to gauge quality of services, choose services, and report illegal and unethical behaviors (e.g., requesting bribes). To the best of our knowledge, this is the first paper to examine the range of citizen applications (?citizen apps?) targeting urban issues and to address their effects on urban planning, decision-making, problem solving, and governance. We examine citizen apps that address a wide range of urban issues from those that solve public transportation challenges to those that improve the management of public utilities and services and even public safety.",doi: 10.1080/10630732.2012.673056,,,
7,,,"Duffy, Simon",The Citizenship Theory of social justice: exploring the meaning of personalisation for social workers,Journal of Social Work Practice,24,3,September,253--267,2010,,,http://dx.doi.org/10.1080/02650533.2010.500118,Journal of Social Work Practice,,,,,Routledge,,,,,,,"Personalisation is a new term that is being used in different ways. Often it is used as a shorthand for a range of new forms of practice, or technologies. These new technologies include direct payments, self-directed support, individual budgets and person-centred planning. The values which underpin these technologies have developed from the experiences of disabled people, but these values are not well represented in theories of social justice. This paper describes a new theory, a Citizenship Theory of social justice, that is based on two fundamental moral beliefs: (a) the equal dignity of all human beings; and (b) the positive value of human diversity and difference. Developing this theory of social justice leads to an inclusive model of citizenship and an imperative to organise society so that everyone can become a citizen. Social workers could see personalisation as an externally imposed dogma, but this will lead to defensiveness, resistance and cynicism. However the profession could instead embrace the technologies of personalisation, and the Citizenship Theory that should underpin it. It is this second path that will lead to critical engagement and the practical use and improvement of the tools of personalisation. Personalisation is a new term that is being used in different ways. Often it is used as a shorthand for a range of new forms of practice, or technologies. These new technologies include direct payments, self-directed support, individual budgets and person-centred planning. The values which underpin these technologies have developed from the experiences of disabled people, but these values are not well represented in theories of social justice. This paper describes a new theory, a Citizenship Theory of social justice, that is based on two fundamental moral beliefs: (a) the equal dignity of all human beings; and (b) the positive value of human diversity and difference. Developing this theory of social justice leads to an inclusive model of citizenship and an imperative to organise society so that everyone can become a citizen. Social workers could see personalisation as an externally imposed dogma, but this will lead to defensiveness, resistance and cynicism. However the profession could instead embrace the technologies of personalisation, and the Citizenship Theory that should underpin it. It is this second path that will lead to critical engagement and the practical use and improvement of the tools of personalisation.",doi: 10.1080/02650533.2010.500118,,,
7,,,"Evans, Mark & Pratchett, Lawrence",The localism gap - the CLEAR failings of official consultation in the Murray Darling Basin,Policy Studies,34,5-6,November,541--558,2013,,,http://dx.doi.org/10.1080/01442872.2013.862448,Policy Studies,,,,,Routledge,,,,,,,"This article argues that the inability of the Commonwealth and State Governments in Australia to affect significant progress on water reform is largely a product of their inability to win the hearts and minds of rural communities; a failure to understand the importance of localism. Hitherto, the failure to bring the politics back in and integrate community voices into the process of policy development has proved the major obstacle to the achievement of a balanced social and environmental perspective in the Murray Darling Basin (MDB) and has served to reinforce traditional prejudices. This article makes four main contributions to the study of communities experiencing stress. Firstly, we present the case for deep local democratization in times of stress. Secondly, we build on a diagnostic tool ? the Can do Like to Enabled to Asked to Responded to (CLEAR) model ? to evaluate the effectiveness of the consultation process underpinning the Guide to the Murray Darling Basin Plan (MDBP) and apply it to the Forbes consultation. Thirdly and fourthly, we use the findings from this evaluation to identify principles of community engagement which provide the best possible conditions for effective social mobilization and the capabilities that are necessary to deliver effective citizen-centric policy outcomes in communities experiencing high levels of stress This article argues that the inability of the Commonwealth and State Governments in Australia to affect significant progress on water reform is largely a product of their inability to win the hearts and minds of rural communities; a failure to understand the importance of localism. Hitherto, the failure to bring the politics back in and integrate community voices into the process of policy development has proved the major obstacle to the achievement of a balanced social and environmental perspective in the Murray Darling Basin (MDB) and has served to reinforce traditional prejudices. This article makes four main contributions to the study of communities experiencing stress. Firstly, we present the case for deep local democratization in times of stress. Secondly, we build on a diagnostic tool ? the Can do Like to Enabled to Asked to Responded to (CLEAR) model ? to evaluate the effectiveness of the consultation process underpinning the Guide to the Murray Darling Basin Plan (MDBP) and apply it to the Forbes consultation. Thirdly and fourthly, we use the findings from this evaluation to identify principles of community engagement which provide the best possible conditions for effective social mobilization and the capabilities that are necessary to deliver effective citizen-centric policy outcomes in communities experiencing high levels of stress",doi: 10.1080/01442872.2013.862448,,,
7,,,"Grainger Clemson, Hannah",Trailfinders--curating an interactive city promenade experience with mobile phones,Digital Creativity,25,4,October,330--342,2014,,,http://dx.doi.org/10.1080/14626268.2014.904362,Digital Creativity,,,,,Routledge,,,,,,,"AbstractWith a growing number of embedded digital experiences in arts and heritage settings, creating a broad global field, this article focuses on the use of mobile phones in the engagement of humans with the cultural heritage of public spaces, specifically those that require a promenade from one outdoor space to another. This article discusses findings from a recent promenade initiative, commissioned for a UK arts festival, along with a review of literature, to critically engage with growing evidence of the diverse ways in which technology is integrated at direct user level. Concepts of ?hybrid spaces? and ?user agency? are discussed, along with the ?performativity? of spaces. Central to the discussion is the function of narrative in engaging the participant to construct new perspectives, which are facilitated by the mediating role of personal media devices between subject, narrative, space and community. AbstractWith a growing number of embedded digital experiences in arts and heritage settings, creating a broad global field, this article focuses on the use of mobile phones in the engagement of humans with the cultural heritage of public spaces, specifically those that require a promenade from one outdoor space to another. This article discusses findings from a recent promenade initiative, commissioned for a UK arts festival, along with a review of literature, to critically engage with growing evidence of the diverse ways in which technology is integrated at direct user level. Concepts of ?hybrid spaces? and ?user agency? are discussed, along with the ?performativity? of spaces. Central to the discussion is the function of narrative in engaging the participant to construct new perspectives, which are facilitated by the mediating role of personal media devices between subject, narrative, space and community.",doi: 10.1080/14626268.2014.904362,,,
7,,,"Hale, Richard & Saville, Martin",Nurturing the H in HR: using action learning to build organisation development capability in the UK Civil Service,Action Learning: Research and Practice,11,3,September,333--351,2014,,,http://dx.doi.org/10.1080/14767333.2014.965021,Action Learning: Research and Practice,,,,,Routledge,,,,,,,"In the UK, the Civil Service Reform Plan is being implemented with urgency. This requires Civil Service departments and agencies to reform their structures and ways of working in order to deliver effective services in a climate of economic austerity and rapid social and technological change. Historically, Human Resource (HR) professionals have provided services based on the HR Business Partner model which has meant a focus on strategic and operational HR services. As part of these changes, HR managers and other professionals are now required to develop their capabilities in providing Organisation Development (OD) advice to their internal clients. In order to make this happen, the Civil Service's expert OD and Design Service launched an OD Capability Building programme and engaged OD specialists Mayvin to deliver it. The programme incorporates the postgraduate level-accredited Action Learning Question method developed by Dr Richard Hale called, in this context, OD Questions (ODQs). Participants on the OD Capability Building programme are required to complete an ODQ over a five- to six-month period. This entails scoping an OD challenge with key stakeholders, conducting some research and making recommendations for change or implementing such change. The participants work in ?action learning sets? and support each other with their problem solving and learning. A final report is written up by each participant leading to the award of postgraduate-level credits. Examples of ODQ areas include: How can I support a newly appointed Director General to align his team to address their challenges at a time of rapid change? How can I help my client department to improve employee engagement? How can I develop my own capability in working as a business partner and adding value alongside my client? In the UK, the Civil Service Reform Plan is being implemented with urgency. This requires Civil Service departments and agencies to reform their structures and ways of working in order to deliver effective services in a climate of economic austerity and rapid social and technological change. Historically, Human Resource (HR) professionals have provided services based on the HR Business Partner model which has meant a focus on strategic and operational HR services. As part of these changes, HR managers and other professionals are now required to develop their capabilities in providing Organisation Development (OD) advice to their internal clients. In order to make this happen, the Civil Service's expert OD and Design Service launched an OD Capability Building programme and engaged OD specialists Mayvin to deliver it. The programme incorporates the postgraduate level-accredited Action Learning Question method developed by Dr Richard Hale called, in this context, OD Questions (ODQs). Participants on the OD Capability Building programme are required to complete an ODQ over a five- to six-month period. This entails scoping an OD challenge with key stakeholders, conducting some research and making recommendations for change or implementing such change. The participants work in ?action learning sets? and support each other with their problem solving and learning. A final report is written up by each participant leading to the award of postgraduate-level credits. Examples of ODQ areas include: How can I support a newly appointed Director General to align his team to address their challenges at a time of rapid change? How can I help my client department to improve employee engagement? How can I develop my own capability in working as a business partner and adding value alongside my client?",doi: 10.1080/14767333.2014.965021,,,
7,,,"Heikkila, Eric J.",Environmentalism with Chinese Characteristics? Urban River Revitalization in Foshan,Planning Theory & Practice,12,1,March,33--55,2011,,,http://dx.doi.org/10.1080/14649357.2011.549747,Planning Theory & Practice,,,,,Routledge,,,,,,,"Human settlements have long been located on rivers, and the relationship of the place to the river functions as a deep reflection of its historical, cultural, and socio-economic traditions. This paper explores urban river revitalization in contemporary China, focusing particularly on ongoing efforts to clean up Foshan's polluted Fenjiang River. The research shows that the traditional cultural status of the waterway, which is known as the ?Mother River? of Foshan, plays a paradoxically pivotal role in the project to modernize it. Interacting in complex ways with domestic and international political concerns, and popular media and internet technologies, the cultural status of the river has helped to determine both the type of environmental movement that has emerged in its defence, and the community of interests that serves as a proxy for civil society in that movement. Ultimately, this paper argues that the unique configuration of institutions and actors engaged in the Fenjiang River restoration project are emblematic of a new type of ?environmentalism with Chinese characteristics.? Human settlements have long been located on rivers, and the relationship of the place to the river functions as a deep reflection of its historical, cultural, and socio-economic traditions. This paper explores urban river revitalization in contemporary China, focusing particularly on ongoing efforts to clean up Foshan's polluted Fenjiang River. The research shows that the traditional cultural status of the waterway, which is known as the ?Mother River? of Foshan, plays a paradoxically pivotal role in the project to modernize it. Interacting in complex ways with domestic and international political concerns, and popular media and internet technologies, the cultural status of the river has helped to determine both the type of environmental movement that has emerged in its defence, and the community of interests that serves as a proxy for civil society in that movement. Ultimately, this paper argues that the unique configuration of institutions and actors engaged in the Fenjiang River restoration project are emblematic of a new type of ?environmentalism with Chinese characteristics.?",doi: 10.1080/14649357.2011.549747,,,
7,,,"Hossain, Liaquat; Khalili, Sanaz & Uddin, Shahadat",Inter-Organizational Coordination Dynamics during Crisis,Journal of Decision Systems,20,4,January,383--396,2011,,,http://www.tandfonline.com/doi/abs/10.3166/JDS.20.383-396,Journal of Decision Systems,,,,,Taylor & Francis,,,,,,,"This paper addresses decision making process for emerging coordination in interorganizational collaborations during disasters. Lack of resources, decision making process, and poor communication are recurring problems for organizational performance in disaster operations. The aim of this study is to explore decision making during crisis through social networks. We hypothesize that the structural positions of organizations within interorganizational collaboration network have implications on the potential to coordinate leading to improved decision making in uncertain environments. To measure the structural positions of nodes, we consider three network attributes: ego-betweenness, degree centrality, and tie strength. A single qualitative survey question is used to measure coordination preparedness. We noticed that all three structural attributes have positive associations with coordination preparedness. This paper addresses decision making process for emerging coordination in interorganizational collaborations during disasters. Lack of resources, decision making process, and poor communication are recurring problems for organizational performance in disaster operations. The aim of this study is to explore decision making during crisis through social networks. We hypothesize that the structural positions of organizations within interorganizational collaboration network have implications on the potential to coordinate leading to improved decision making in uncertain environments. To measure the structural positions of nodes, we consider three network attributes: ego-betweenness, degree centrality, and tie strength. A single qualitative survey question is used to measure coordination preparedness. We noticed that all three structural attributes have positive associations with coordination preparedness.",doi: 10.3166/JDS.20.383-396,,,
