BibliographyType,ISBN,Identifier,Author,Title,Journal,Volume,Number,Month,Pages,Year,Address,Note,URL,Booktitle,Chapter,Edition,Series,Editor,Publisher,ReportType,Howpublished,Institution,Organizations,School,Annote,Abstract,Custom2,Custom3,Custom4,Custom5
7,,,"Ogola, George",Social media as a heteroglossic discursive space and Kenya's emergent alternative/citizen experiment,African Journalism Studies,36,4,October,66--81,2015,,,http://dx.doi.org/10.1080/23743670.2015.1119490,African Journalism Studies,,,,,Routledge,,,,,,,"ABSTRACTOver the past decade, Kenya's media landscape has witnessed a wave of transformative and disruptive technologies in the form of Web 2.0 applications, accessible through computers and now increasingly through mobile phones. These developments have since incubated two new critical media regimes. First, the country has seen the emergence of a new community of communication practitioners. Second, a new web-enabled communication infrastructure has made possible the broadening of the public sphere, encouraging public participation in news, with non-traditional journalistic platforms becoming important sites for ?alternative? journalism. This article critically reflects on how social media platforms such as Twitter (read here as a heteroglossic text and space) enable and encourage public participation in wider national conversations. The article explores this through the work of key bloggers/activists and citizen journalists, reflecting on how they construct as well as enable new participatory forms of civic/political engagement through Twitter. While the platform seems to have created its own hierarchies, horizontal participation is still much greater than with mainstream media formats. The discussion demonstrates the growing institutionalisation of the online space as an important platform for popular expression in Kenya, if at the same time offering an indictment of mainstream media's regime of ?closure? to outsider voices. ABSTRACTOver the past decade, Kenya's media landscape has witnessed a wave of transformative and disruptive technologies in the form of Web 2.0 applications, accessible through computers and now increasingly through mobile phones. These developments have since incubated two new critical media regimes. First, the country has seen the emergence of a new community of communication practitioners. Second, a new web-enabled communication infrastructure has made possible the broadening of the public sphere, encouraging public participation in news, with non-traditional journalistic platforms becoming important sites for ?alternative? journalism. This article critically reflects on how social media platforms such as Twitter (read here as a heteroglossic text and space) enable and encourage public participation in wider national conversations. The article explores this through the work of key bloggers/activists and citizen journalists, reflecting on how they construct as well as enable new participatory forms of civic/political engagement through Twitter. While the platform seems to have created its own hierarchies, horizontal participation is still much greater than with mainstream media formats. The discussion demonstrates the growing institutionalisation of the online space as an important platform for popular expression in Kenya, if at the same time offering an indictment of mainstream media's regime of ?closure? to outsider voices.",doi: 10.1080/23743670.2015.1119490,,,
7,,,"Papaioannou, Theo",From consultation to deliberation? A qualitative case study of governing science and technology projects for the public good,Critical Public Health,22,2,June,235--251,2012,,,http://dx.doi.org/10.1080/09581596.2011.630979,Critical Public Health,,,,,Taylor & Francis,,,,,,,"The concept of ?public consultation? and the idea of ?democratic deliberation? describe different forms of engagement of various citizens and stakeholders in the governance of science and technology projects (STPs). On the one hand, public consultation is concerned with enhancing the quality of decisions through public understanding of a complex STP. On the other hand, democratic deliberation is concerned with taking quality decisions through communicative action and free argumentation between all parties affected. This article focuses on the STP of the UK Biobank, addressing the following question: which form of upstream engagement is required in governing the next phase of the UK Biobank for the public good of health? Drawing on political theory debates and qualitative evidence, it is argued that although ideal democratic governance of the (next phase of) UK Biobank requires transition from public consultation to democratic deliberation the latter faces practical limitations. Thus, deliberative engagement cannot be full in specific STPs for the public good of health. The concept of ?public consultation? and the idea of ?democratic deliberation? describe different forms of engagement of various citizens and stakeholders in the governance of science and technology projects (STPs). On the one hand, public consultation is concerned with enhancing the quality of decisions through public understanding of a complex STP. On the other hand, democratic deliberation is concerned with taking quality decisions through communicative action and free argumentation between all parties affected. This article focuses on the STP of the UK Biobank, addressing the following question: which form of upstream engagement is required in governing the next phase of the UK Biobank for the public good of health? Drawing on political theory debates and qualitative evidence, it is argued that although ideal democratic governance of the (next phase of) UK Biobank requires transition from public consultation to democratic deliberation the latter faces practical limitations. Thus, deliberative engagement cannot be full in specific STPs for the public good of health.",doi: 10.1080/09581596.2011.630979,,,
7,,,"Poole, Kerry D.; Berson, Michael J. & Levine, Peter",On Becoming a Legislative Aide: Enhancing Civic Engagement Through a Digital Simulation,Action in Teacher Education,32,4,December,70--82,2010,,,http://dx.doi.org/10.1080/01626620.2010.549733,Action in Teacher Education,,,,,Routledge,,,,,,,"ABSTRACT Civics education in the United States often is designated as a low priority in the curriculum and is typically characterized by passive, rote learning that is centered around content and materials provided by textbook companies. Results from recent assessments of America's students suggest that the current generation possesses only a superficial knowledge of civics and is less engaged in traditional political activities. Some educators are looking beyond traditional methods of instruction and exploring how technology, computing, and gaming may be integrated with student learning, including service learning. This article describes the implementation of Legislative Aide software into high schools to support community-based research and service learning. Young people use this technological tool to role-play as aides to an imaginary local elected official in a virtual legislative office. The software guides the students in investigating real community problems and proposing real community action plans to address the problems. ABSTRACT Civics education in the United States often is designated as a low priority in the curriculum and is typically characterized by passive, rote learning that is centered around content and materials provided by textbook companies. Results from recent assessments of America's students suggest that the current generation possesses only a superficial knowledge of civics and is less engaged in traditional political activities. Some educators are looking beyond traditional methods of instruction and exploring how technology, computing, and gaming may be integrated with student learning, including service learning. This article describes the implementation of Legislative Aide software into high schools to support community-based research and service learning. Young people use this technological tool to role-play as aides to an imaginary local elected official in a virtual legislative office. The software guides the students in investigating real community problems and proposing real community action plans to address the problems.",doi: 10.1080/01626620.2010.549733,,,
7,,,"Porter, Libby; Lombard, Melanie; Huxley, Margo; Ingin, Aslı Kıyak; Islam, Tolga; Briggs, John; Rukmana, Deden; Devlin, Ryan & Watson, Vanessa","Informality, the Commons and the Paradoxes for Planning: Concepts and Debates for Informality and Planning Self-Made Cities: Ordinary Informality? The Reordering of a Romany Neighbourhood The Land Formalisation Process and the Peri-Urban Zone of Dar es Salaam, Tanzania Street Vendors and Planning in Indonesian Cities Informal Urbanism in the USA: New Challenges for Theory and Practice Engaging with Citizenship and Urban Struggle Through an Informality Lens",Planning Theory & Practice,12,1,March,115--153,2011,,,http://dx.doi.org/10.1080/14649357.2011.545626,Planning Theory & Practice,,,,,Routledge,,,,,,,,doi: 10.1080/14649357.2011.545626,,,
7,,,"Ricke, LaChrystal",A New Opportunity for Democratic Engagement: The CNN-YouTube Presidential Candidate Debates,Journal of Information Technology & Politics,7,2-3,May,202--215,2010,,,http://dx.doi.org/10.1080/19331681003772768,Journal of Information Technology & Politics,,,,,Routledge,,,,,,,"ABSTRACT The 2007 CNN-YouTube Presidential Candidate Debates provided a unique opportunity for Americans to engage in national political discussion. For the first time in American political history, the public was invited into national debate discourse through submissions of video questions to YouTube for possible inclusion in two nationally broadcast candidate debates. Content analysis was used to examine the nearly 8,000 submissions to uncover both the demographic populations represented and the submitted questions' characteristics to determine if the debates provided a viable method for increasing citizen mobilization and redefining democratic participation in the Internet Age. Results indicate that traditionally politically underrepresented or disengaged populations were present in a significant number of submissions and that the submissions were politically substantive. ABSTRACT The 2007 CNN-YouTube Presidential Candidate Debates provided a unique opportunity for Americans to engage in national political discussion. For the first time in American political history, the public was invited into national debate discourse through submissions of video questions to YouTube for possible inclusion in two nationally broadcast candidate debates. Content analysis was used to examine the nearly 8,000 submissions to uncover both the demographic populations represented and the submitted questions' characteristics to determine if the debates provided a viable method for increasing citizen mobilization and redefining democratic participation in the Internet Age. Results indicate that traditionally politically underrepresented or disengaged populations were present in a significant number of submissions and that the submissions were politically substantive.",doi: 10.1080/19331681003772768,,,
7,,,"Rowe, Ian",Civility 2.0: a comparative analysis of incivility in online political discussion,"Information, Communication & Society",18,2,February,121--138,2015,,,http://dx.doi.org/10.1080/1369118X.2014.940365,"Information, Communication & Society",,,,,Routledge,,,,,,,"In an effort to clean up user comment sections, news organizations have turned to Facebook, the world's largest social network site, as a way to make users more identifiable and accountable for the content they produce. It is hypothesized that users leaving comments via their Facebook profile will be less likely to engage in uncivil and impolite discussion, even when it comes to discussing politically sensitive and potentially divisive issues. By analysing the content of discussion as it occurs in response to political news content on the Washington Post Facebook, and comparing it to that which occurs on the Washington Post website where users are afforded a relatively high level of anonymity, the present study determines the extent to which Facebook increases the level of civility and impoliteness in an area of political discussion renowned for uncivil and impolite communicative behaviour. In line with earlier theories of social interaction, the paper finds that political discussion on The Washington Post website is significantly more likely to be uncivil than discussion of the same content on the Washington Post Facebook page. Moreover, the incivility and impoliteness on the Washington Post website are significantly more likely to be directed towards other participants in the discussion compared to The Washington Post Facebook page. In an effort to clean up user comment sections, news organizations have turned to Facebook, the world's largest social network site, as a way to make users more identifiable and accountable for the content they produce. It is hypothesized that users leaving comments via their Facebook profile will be less likely to engage in uncivil and impolite discussion, even when it comes to discussing politically sensitive and potentially divisive issues. By analysing the content of discussion as it occurs in response to political news content on the Washington Post Facebook, and comparing it to that which occurs on the Washington Post website where users are afforded a relatively high level of anonymity, the present study determines the extent to which Facebook increases the level of civility and impoliteness in an area of political discussion renowned for uncivil and impolite communicative behaviour. In line with earlier theories of social interaction, the paper finds that political discussion on The Washington Post website is significantly more likely to be uncivil than discussion of the same content on the Washington Post Facebook page. Moreover, the incivility and impoliteness on the Washington Post website are significantly more likely to be directed towards other participants in the discussion compared to The Washington Post Facebook page.",doi: 10.1080/1369118X.2014.940365,,,
7,,,"Scholz, Miklas; Hedmark, Åsa & Hartley, William",Recent advances in sustainable multifunctional land and urban management in Europe: a review,Journal of Environmental Planning and Management,55,7,September,833--854,2012,,,http://dx.doi.org/10.1080/09640568.2011.628828,Journal of Environmental Planning and Management,,,,,Routledge,,,,,,,"This review discusses high impact research in sustainable urban and land management. The focus is on large European projects that have a holistic and multi-disciplinary assessment approach towards the total environment. This paper clearly indicates that many projects propose decision-making tools partly supported by numerical models. Successful projects were identified as applying the following criteria: a communicative and holistic approach involving economic, environmental and social sciences throughout the project; sufficient geographic coverage; engagement of stakeholders from a wide variety of sectors; and plans for dissemination of project outcomes and active knowledge sharing. This review discusses high impact research in sustainable urban and land management. The focus is on large European projects that have a holistic and multi-disciplinary assessment approach towards the total environment. This paper clearly indicates that many projects propose decision-making tools partly supported by numerical models. Successful projects were identified as applying the following criteria: a communicative and holistic approach involving economic, environmental and social sciences throughout the project; sufficient geographic coverage; engagement of stakeholders from a wide variety of sectors; and plans for dissemination of project outcomes and active knowledge sharing.",doi: 10.1080/09640568.2011.628828,,,
7,,,"Shklovski, Irina & de Souza e Silva, Adriana",AN URBAN ENCOUNTER,"Information, Communication & Society",16,3,April,340--361,2013,,,http://dx.doi.org/10.1080/1369118X.2012.756049,"Information, Communication & Society",,,,,Routledge,,,,,,,"Computing research has long been interested in location-aware mobile games, such as hybrid reality games, location-based games and urban games. With an increasingly pervasive IT infrastructure and comparatively affordable mobile devices, such games are becoming part of everyday play around the world. A study of an urban night-game called Encounter widely played in the Former Soviet Union and the Russian-speaking Diaspora is presented. The ways in which IT enables a complex interaction between the local experience of play in the urban environment and the geographically distributed nature of the player community are considered. The findings illustrate how this form of location-aware mobile game-play pulled together local engagement and global player communities into socio-technical assemblages, showing the interplay between local attachments, distant connections and the location-based communication in daily experience. The most important outcome of these games then was not the direct individual engagement with the urban environment through technology or the collaboration with strangers in the course of play (although these were the necessary prerequisites), but the social relationships that, while gained in-game, could be leveraged for civic engagement, belonging and mutual support. While the local, physical experience of the everyday and the game was important, the connections to the distributed community resulted in expanded horizons and changed the nature of the local experience as players felt they could belong to something larger than the locales they physically inhabited. Computing research has long been interested in location-aware mobile games, such as hybrid reality games, location-based games and urban games. With an increasingly pervasive IT infrastructure and comparatively affordable mobile devices, such games are becoming part of everyday play around the world. A study of an urban night-game called Encounter widely played in the Former Soviet Union and the Russian-speaking Diaspora is presented. The ways in which IT enables a complex interaction between the local experience of play in the urban environment and the geographically distributed nature of the player community are considered. The findings illustrate how this form of location-aware mobile game-play pulled together local engagement and global player communities into socio-technical assemblages, showing the interplay between local attachments, distant connections and the location-based communication in daily experience. The most important outcome of these games then was not the direct individual engagement with the urban environment through technology or the collaboration with strangers in the course of play (although these were the necessary prerequisites), but the social relationships that, while gained in-game, could be leveraged for civic engagement, belonging and mutual support. While the local, physical experience of the everyday and the game was important, the connections to the distributed community resulted in expanded horizons and changed the nature of the local experience as players felt they could belong to something larger than the locales they physically inhabited.",doi: 10.1080/1369118X.2012.756049,,,
7,,,"Smith, Elizabeth S. & Bressler, Alison",Who Taught You to Talk Like That?: The University and Online Political Discourse,Journal of Political Science Education,9,4,October,453--473,2013,,,http://dx.doi.org/10.1080/15512169.2013.835565,Journal of Political Science Education,,,,,Routledge,,,,,,,"Rancorous dialogue among political opponents is nothing new in the American political system. However, in the past two decades or so, pundits and scholars have noted an increase in the overall intensity and frequency of incivility among elected officials and citizens. At the collegiate level, many universities have undertaken some form of civility initiative to help students learn how to address political conversation in a civil manner. However, these initiatives are problematic in that they may tend to attract those already predisposed to such civility goals and lack in external validity. In this article, we investigate how university communities may be able to use online discussions, particularly spontaneous ones, to address controversial political issues. Using the asynchronous online postings at one liberal arts university, Furman University, in response to a campus visit by George W. Bush, we investigate the nature of political discourse in these unstructured political conversations. Through content analysis, we assess the level of democratic incivility versus impoliteness in the discussion, the role of anonymity in facilitating incivility, and the potential of such online exchanges for use by colleges to help socialize young people into how to engage in effective and civil political discourse. Rancorous dialogue among political opponents is nothing new in the American political system. However, in the past two decades or so, pundits and scholars have noted an increase in the overall intensity and frequency of incivility among elected officials and citizens. At the collegiate level, many universities have undertaken some form of civility initiative to help students learn how to address political conversation in a civil manner. However, these initiatives are problematic in that they may tend to attract those already predisposed to such civility goals and lack in external validity. In this article, we investigate how university communities may be able to use online discussions, particularly spontaneous ones, to address controversial political issues. Using the asynchronous online postings at one liberal arts university, Furman University, in response to a campus visit by George W. Bush, we investigate the nature of political discourse in these unstructured political conversations. Through content analysis, we assess the level of democratic incivility versus impoliteness in the discussion, the role of anonymity in facilitating incivility, and the potential of such online exchanges for use by colleges to help socialize young people into how to engage in effective and civil political discourse.",doi: 10.1080/15512169.2013.835565,,,
7,,,"Thompson, Michelle M.",The city of New Orleans blight fight: using GIS technology to integrate local knowledge,Housing Policy Debate,22,1,January,101--115,2012,,,http://dx.doi.org/10.1080/10511482.2011.634427,Housing Policy Debate,,,,,Routledge,,,,,,,"Planners have a unique ability to consume information and address both policy and practical issues on a variety of scales ? from neighborhood to regional to international. The use of information technology, specifically geographic information systems, continues to expand the planners' toolkit. Applying these tools requires planners to go beyond synchronous inductive and deductive reasoning and move towards ?integrated thinking?. Spatial literacy allows citizen planners to question and advocate for public policies based upon community data that has not been readily available to decision makers in municipal government. This report identifies examples of how a public participation geographic information system (PPGIS) increases engagement of stakeholders through increased access to and integration of municipal data. Post Hurricane Katrina, the Beacon of Hope ? University of New Orleans Community Recovery Project (BUCRP) led to a shift in citizen participation by a community-led PPGIS. The BUCRP follows standards and replicable training methods to improve accuracy and reliability of crowd sourcing data. The development of tools and traditions where community data complements municipal resources can be used in weak market cities and those urban areas devastated as a result of natural or man-made disasters. Planners have a unique ability to consume information and address both policy and practical issues on a variety of scales ? from neighborhood to regional to international. The use of information technology, specifically geographic information systems, continues to expand the planners' toolkit. Applying these tools requires planners to go beyond synchronous inductive and deductive reasoning and move towards ?integrated thinking?. Spatial literacy allows citizen planners to question and advocate for public policies based upon community data that has not been readily available to decision makers in municipal government. This report identifies examples of how a public participation geographic information system (PPGIS) increases engagement of stakeholders through increased access to and integration of municipal data. Post Hurricane Katrina, the Beacon of Hope ? University of New Orleans Community Recovery Project (BUCRP) led to a shift in citizen participation by a community-led PPGIS. The BUCRP follows standards and replicable training methods to improve accuracy and reliability of crowd sourcing data. The development of tools and traditions where community data complements municipal resources can be used in weak market cities and those urban areas devastated as a result of natural or man-made disasters.",doi: 10.1080/10511482.2011.634427,,,
